text,labels
R F R R L R K W T R W R L K K I A M D,0
A C T K W K L F K K I F K R I V Q R I K D F L R A M D,1
G L K E I F K A G L G S L V K G I A A H V A S A M D,0
A T Y R T G R A T R E S L S G V E I S G R L Y R L R,1
P I I K R F L G K L T I P V Q R,0
R F R R L R K K I R K R L K K I A M D,1
M A F K K L E K V G R N I R D G I I K A G P A V A V I G Q A T S I A R P T G K,1
G F F G K R K E Y F K K F G A S F K R R F A N L K K R L,1
T D Q L Q A L G I K V F G P T K A G A E L E A S K S W,0
A C T K W K S F L K T F K S A K K T E L H T A L K A I S S A M D,0
I G M G E R T S H Q A I G Q V A R A L F A K G A A Q R V,0
R F G R F L R K I R R F R P K V T I T I Q,1
G L G S L L G K A F K I G L K T V G K M M G G A P R E Q,0
P A G P A G T G K T E T T K D M G R C L G K Y V V V F N C S D Q,0
V R R F A W W W A F L R R,1
H T T M V S E E I I M Q F L N S,0
G R T L S G Q T G E G F V I S V S H G E P L C I G L N C A L G A A E M R P F I E I I G K C T T A Y V L C Y,0
F F H H I F R A I V H V P K T I H R L V T G,1
A C T P K R K S A T K G D E P A A M D,0
G R V I A R P F I G D K A G N F Q,0
P E D D R T L D D D E L A E Y D L D K Y D E,0
D L T D Q P L P D A D H T W Y T D G S S L L Q E G Q R K A G A,0
Y E E E S E D L D Y E D S E G Q D Y E E A V E S Q Y,0
K W K S F L R T F K S P V R T V F H T A L K P I S S,1
V I F S R C R D E M F M T A G N G T I R V,0
G L P V C G E T C T L G T C Y T Q G C T C S W P I C K R N,1
G F K L K G M A R I S C L P N G Q W S N F P P K C I R E C A M V S S,1
G S P A L I S W I K R K R Q Q A M D,0
K K T W W K T W W T K W,0
R R W R I V V I R V R R A M D,1
E V G A I E R L L Q V F D L P V T P P D Y,0
G A F E T R F V S Q V E S D S G D R R,0
I L R A L G G E P P V Y A H L P T V L N E Q G E K M S K R,0
G G S M G G G L Q F P S N L R G L P A L F L G L I K H V G L R K S A Q,0
I L P W K W P L W P W R R,1
I A P F T V G I L P M N M H K S H,0
G F M K Y I G P L I P H A V K A I S K L I A M D,1
R L V R I L V S K R P V A I K P Y F R L,0
R Q L R R R T R K E V R A V S M S N L R T L V F Y A T P E H P C S,0
I N W N E Q R L I A Y A E N L,0
R G F V R V A M V K G K P L,0
W A R F E V E R A Q W E V E R A,0
G P P M M N A A V I K M L K D L G,0
A I D G G K K T A A F S N I E Y G G R G M S L E K D I E H S N T F Y L K,0
G L F T L I K G A A K L I G K T V A K E A G K T G L E L M A C K I T N Q C,1
C G E S C V F I P C I S T L L G C S C K N K V C Y R N G V I P,1
K K K K K K K K K K K K K K K K K K K K G I G K F L H S A K K F G K A F V G E I M N S,1
Q C R R L C Y K Q R C V T Y C R G R,1
R A A N K F P A I I Y G G K E A P L A I E L D H D K V M N M Q,0
F F H H A F R G I V H V G K T I H R L V T G A M D,1
G V S K I L H S A G K F G K A F L G E I M K S,1
V I E V E G T V V E N L P N A M F R V E L P N,0
E V D G V T S D D E D E Y I E E T D A L G N T,0
T C Y C R R R F C V C V G R,1
G W G S I F K H G R H A A K H I G H A A V N H Y L A M D,1
K R A I D R G V G G A D G A N Y E E I R Y E G Y G I S,0
Q L R L E A E I V T D K R G I W K F A C R A L V D G N V V C S A E I L,0
G R K K R R Q R R R P P Q,1
I E A L A A N A G T G F A V A E P Q I A M F C G K L N M H V N,0
I L P W K W K W W K W R R A M D,1
D A A C A A H C L W R A M D,1
P E V Q Q R N S L D F G K A P S L L W T D N G G S N D R C E,0
F L F S L I P H A I G G L I S A F K,1
M L N I M R Y C I D E L H S E E G M T L E A V L Q I N E T K L D E L I,0
H Y E G I L Q E R L D E L G E M P L,0
V S D V L K A L E A K I V R W N I L D D G I R,0
T V T A S L G E E T A F L C E V Q Q G G I F S I A G I E G T Q M A H C L,0
E N F F K E I E R A G Q R I R D A I I S A A P A V E T L A Q A Q K I I K G G D,1
V G M H D K L F K R A R V M Y E I E R D I S,0
F S E N E R L T N S I I W N S P N V S I N R Q R K S Y P L T T K V,0
V R R F A W W W A F L R R,1
G E C I W D A I F H G A K H F L H R L V N P,1
F F H H I F R G I V H V A K T I H R L V T G,1
K I K I P W G K V K D F L V G G M K A V,1
R G G R L C Y C R R R F C V C L,1
R R W R I V V I R W R R A M D,0
H R H Q G P I F D T R P S P F N P N Q P R P G P I Y,0
G I L G K L W E G F K S I V,1
G I G A V L K V L T T G L P A L I S W I K R K R Q Q,1
G M A T A A G T T L G K L A K F V I G A V A M D,1
K K E G V T P Q E V I D K Y D G I I R K S F A D F G I S F N N Y S,0
I D E Y D Y G Y C I R W,0
G I L G K L W E G F K S I V,1
E I Y A A R E K A E G A E G E T I Q R G D,0
I L P L K L P L L P L R R A M D,1
K S G L I P D G N A M E N L E K Q L I C P I C L E M F,0
L T L F E P D N S S H P I T L,0
I S V M I E V Y G R S K E H D D C A C D G E T C T V,0
V K R A L S A L K P K N K R F I G G I I S F I K K L F G,1
G V L S V T V P A K K V D,0
K K K K K K K K K K K K K K K K K K K K G I G K F L H S A K K F G K A F V G E I M N S,1
Q Q R K R K G I G A V L K V L T T G L P A L I S W I,1
R I L R G V S R R I M R R I L T G R R,1
L N I P I F R I D F I K E Y W D E V F S D,0
R E K L L A Y A E K N G I D I T R K P G K S P Y S M D A N L L H I S Y E,0
G I P C A E S C V W I P C T V T A L V G C S C S D K V C Y N,1
P P S P R S V D Q V K S Q L R T A L A S G G V,0
V C E T G L L P R T H G S A L F T R G E T Q G L V V T T L G T G D,0
G L S A L I S W I K R K R Q Q A M D,1
G I W S S I K N L A S K A W N S D I G Q S L R N K A A G A I N K F V A D K I G V T P S Q A A S,1
F I G L L I S A G K A I H D L I R R R H A M D,1
I V P E E P T L P F P E K V R C I K K Y Q,0
L N T D L K R E R D Q F A R F L S M V V E H K H R,0
T M N L P V A T A L F T P S W H,0
A N V G F V I Q L Q A R L R G F L V R Q K F A,0
N R L A R H F R D I A G R V N Q R L,1
I S R L A G L L R K G G E K I G E K L K K I G Q K I K N F F Q K L V P Q P E,0
L D F L A V A V A D L G S I A E R,0
W L A V R H N L N T L N D I K I W W Q I C Y L P T L,0
G L L S G I L G A G K Q K V C G L S G L C,1
F I G L L I S A G K A I H D L I R R R H,1
F S K Y E R Q K D K R P Y S Q R K N Q Y T G P Q F L Y P P E R I P P Q K V I K W N E E G L P I Y E I P G E G G H A E P A A A,1
R A F D H Y W P R F G V,0
G I G A V L K V L T T G L C A L I S W I K R K R Q Q,1
R R W P W W P W K W P L I,1
P N L S G F V S W K M A L S I S V G V L V,0
G A A R K S I R L H R L Y T W K A T I Y T R,0
G L G K F L H S A K R F G K A F V G E A M N S,1
P T L I S R L A D R F G V Q A I V V G I D S W F E Q E T G,0
G L K K I F K A G L G S L V K G I K A H V A S A M D,1
R W K I A K K I E K V G R N V R D G I I K A G P A V A V V G Q A A T V V K A M D,0
P M I V H V L R R A L A A S I G R V A V A T D T P E I A E A V I A H,0
G I G K F L H A A K K F A K A F V A E I M N S,1
G I G A V L K V L T T G L P A L I K R K R Q Q,1
S L C R T D H L C R S R L,0
T D T N V I G E C F D E W S R C H R Q T R W W T K I L F Q S C E N R C K C K V Q L M G N C I K V P F K C F L W K Q K R F M C E C Y G P I S G T K P W Y C G W E L,1
G W M S E K K V Q G I L D K K L P E G I I R N A A K A I V H K M A K M Q F G C F A N V D V K G D C K R H C K A E D K E G I C H G T K C K C G V P I S Y L,1
L V R G C W T K S Y P P K P C F V R,1
F F H H I F R P I V H V P K T I H R L V T G,1
G F M K Y I G P L I P H K V K A I S D L I,1
L L G M I P L A I S A I S A L S K L A M D,1
E E P Q E G G E E E E E E E E E,0
C V I S A G W N H K I R C K L T G N C,1
M R G Y S E C G D G S P A V Y T C V D D L C R G Y D L T R L S Y G R S,0
K P Y L K R F Q V Y Y K G R M W C,0
I N W K K G K E V L K A L,1
G K M K E Y F K K F G A S F K R R F A N L K K R L A M D,1
R R A F L L A S D E E V A,0
T S V D F K D T D Y K R H Q,0
F P F L L S L I P S A I S A I K R L A M D,1
S A V L R H L R R F L L R K H R K H,1
S T L A S E G S Y G E K G V E S F T Q I S K E A G G L C I A Q S,0
I L P W K W P W W P W R R,1
G E F A I A R K N V S I N E A V,0
I W S A I W S G I K G L L A M D,1
Y S M G V R E Q I I F P E I D Y,0
A C T K W K S F L K T F K S A K K T V L H T A L K A I S S A M D,0
F F H H I F R G I V H V P K T I H R L V T G,1
F S I S P G K V L D K F G K I V G K V L K Q L K K V S A V A K V,1
V N R D Y R V C D S Y P T E L Y V P K,0
A C T K W K S F L K T F K S L K K T V L H T L L K A I S S A M D,0
C G E S C V W I P C I S S A V G C S C K N K V C Y K N G T P,1
S M V L E E Q A E S D G S D S H V L L G K A M K R N S N T S,0
A E S W E I I K L I Q D F P R I I K R T S D N F E P S,0
L F G F L I P L L P H I I G A I P Q V I G A I R,1
A K R H H G Y K R K F H A K R H H G Y K R K F H A K R H H G Y K R K F H A M D,1
F S E A I K K I I D F L G A M D,0
Y L Y V D C S N I P S I S L D P G F R S M S D Q N Q V Q M L I N T Y K R,0
G F M K Y I K P L I P H A V K A I S K L I,1
A A G L A M L F L G I L S A A G S T M G A R A,1
Y A E P E A F H A V Q T A F K A A G V E E F A V A E L T M L P,0
A W A S F F K K A A H V A K H V A K A A L T H Y L,1
K R R G D I F R F T I A D I P G I I E G A S M G I G L G L,0
F H P S L W V L I P Q Y I Q L I R K I L K S G,1
D P D D V C S Y L A A A M Q F F E G T C P E D W T S,0
S K K L F K K I L K Y L A G P A G I G K F L H S A K,0
E K Q F R N T F K I A R K K S G N T A E N L,0
R G G G L C Y C R R R F C V C V G R,1
M A W N S Q M M L T L W I V T I V L I F S S S R C E R I L D L R K T K K S C K N G E V L G C V S G H G P P G C S E N E C G M G P R P K A C F F D C H Y G C W C T G K L Y R R K R D R K C V P K H E C L L,1
R L Y R K V Y G R L Y R K V Y G R L Y R K V Y G R L Y R K V Y G R L Y R K V Y G R L Y R K V Y G R L Y R K V Y G R L Y R K V Y G K K K K K K K,1
G I G K F I H A V K K W G K T F I G E I A K S,1
D A T V V Y G V N Q H L L,0
G V A K F G K A A A H F G K G W I K E M L N S,1
K W K V F K K I E K N G R N I R N G I V K A G P A I A V L G E A K A L,1
Y N G I R D M K K L P D V I W I V D T V R E K I,0
A K R H H G Y K R K F H,0
R L C Y T R G R F T V C V,1
G L F D I I K K I A E S F A M D,0
A N D K D T L V M E L S S,0
G K L I K K F G R K A I S Y A V K K A R G K H,1
W L L E Y A P S R L T G T G A C V F A E F D T E,0
R A T L H I D E I I D M V T R L L D R G H A Y V A A D G D V L F,0
N N E Q I R R F S Q V L L D A G I V T T I R K T R G D D I D A,0
I L P W K W K W W P W R R,1
G F F A L I P K I I S S P L F K T L L S A V G S A L S S S G E Q E,1
A V A V V G Q A A T V V K A M D,1
M K K V M H G D R I V A V I H T E K E R,0
G L P R K I L C A I A K K K G K C K G P L K L V C K C,1
I C Y C R R R F C V C V G R,1
C G E S C V W I P C I S S A V G C S C K N K V C Y K N G T P,1
G F F G K M K E Y F K K F G A S F K R R F A N L K K R L A M D,1
D G K V R E V S H V L E L L K D A P E P D T M D S D S D M,0
E K M T I E Q M A L A I R Y G S G I,0
A R A V A G S D L S R R I E L D G P,0
G L P K C G E T C V G G T C N T P G C T C S W P V C T R N,1
Y G R K K R R Q R R R S I S L L,0
D D V E L M L E A N R I G G R H G L G M S D Q I E N R I I E A K S R G,0
F F G W L I R G A I H A G K A I H G L I H R R R H A M D,1
K A E V N C I G G K C P E G K K N C N C M P P I A H V,0
P L P D Q S S C W Y E V V T H G G S Q P T G,0
H S S G T V I L D Q L G E E H M K T G K P I F Y T S A D S V F Q I A,0
P K D L K E T L Q E K K P,1
N N H E H K Q P L P S L A I A A I G V V F G D,0
S W K S F L K T F S S A K S T V L H T A L K A I S S,1
E G A K A V A S G M N P M D L K R G I D L A V D A V V K E L K N N A R K,0
S S L L E K G L D G A K K A V G G L G K L G K D A V E D L,1
L P E G T S A Q K A E L V A L T Q A L R L A E G K,0
I K I P S F F R N I L K K V G K E A V S L I A G A L K Q S,1
A C T K W K S F L K T F K S L K K T V L H T L L K A I S S A M D,0
K V K W Q Q V R Q E L A E E Y E Q V K S I V,0
R W R R I V V I R V R R A M D,0
K K K K K K A A F L A W A L F A A,1
F C Y C R R R F C V C V G R,1
G H K S A E V R A P K P D C K V E K K K M E L Q E K S R W,0
I R G V K V G P S P D W L Q Q R L L A A G T R P I N,0
A C T G F G C N G P W D E D D M Q C H N H C K S I K G Y K G G Y C A K G G F V C K C Y A M D,0
K Y D H L K D K A V V T Y C T G G V R C E V L S S L,0
F Q P P K L K D K L K W S N S F H H F V K M A L T K,0
R Y G E V P L P P Y I K C H D P S D S E R Y Q T R,0
R R F P F F P F K F P L I A M D,1
R G G R L C Y C R R R F C V C Y,1
S G D S A D V A R D V K Q P T A T P R,0
G F K R I V Q R I K D F L R N L V A M D,1
G I G K F A H S A K K F G K A F V G E I M N S,1
S D A G N T E K Q W S L A D F E I G R P L G K G K F G R V Y L A R E A,0
K W K S F L K T F K S A A K T V L H T A L K A I S S,1
R F R R L R K K K R K R L K K I A M D,1
S G I Q F R R L N A S K G A A V R A T R,0
F F H H I F R A I V H V P K T I H R L V T G,1
K W K S F L K T F K S A V K T V L H T A L K A I S S,1
L H N F N S K I Q A V V Q H S G V K,0
M I R I A M K A L N C F K V S G L K C W S F N S P R G Q E S P C P G,1
G L F P K F N K K K V K T G I F D I I K T V G K E A G M D V L R T G I D V I G C K I K G E C,1
E D Y D L A G F C V G V V E K S E I I D G S K V A T G D A L I A,0
G F M K Y I G P L I P H A V K A I S K L I,1
L N K L L G S V V I S Q G G V L P H I M A E L,0
S T I G D L V K W I I D T V N K F T K K,1
W R R R Y R R W R R R R R W R R R P R R A M D,1
L C Y C R R R F C F C V,1
G L P V C G E T C V G G T C N T P G C K C S W P V C T R N,1
D G S Q D S P I F M Y A P E F K F M,0
W L N A L K K V F Q G I H E A I K L I W N H V Q A M D,1
G L N A L K K V F Q G F H E A I K L I N N H V Q,1
F F G H I W H G A R T L F R D V F A A M D,0
N N L L R A I E A Q Q H L L Q L T V W G I K Q L Q A R I L A V E R Y L K D Q,1
T C Y C R R R F C V C V G R,1
R G G R L C Y C R R R F C V C T,1
G K L T K D K L K R G A K K A L N V A S K V A P I V A A G A S I A R A M D,0
T G A G M M D C K K A L N E T S G D L T K A T E W L R Q K G I A S,0
K S F E P L P T F T P E L F M R V Q A K N V M K Q K S F Q K G I D Q,0
S M L S V L K N L E K V E L E F V A C K I N K Q C,0
M K L G L L V V L A V A V L V P S L S E Q D F P S C Q L K E P N Q T P V E A G N M R N K R E A D E S S E E F D L A E M,1
K W K S F L R T F K S P V R T V F H T A L K P I S S,1
E D K Q C R E V T Y K S K Y E K G G,0
G I I N T L Q K Y Y C R V R G G R C A V L S C L P K E E Q I G K C S T R G R K C C R R K K,1
R G G R L C Y C R R R F C V C V,1
M A Y S Q A L Q A F A C G I N P S A E M N P I L L K P Q G N S,0
F L R F I G S V I H G I G H L V H H I G V A L,1
A C T A L K S L L K T L S A A A K K A L A T L L K A L S K A M D,1
N W T L K V D E S A K T L K E,0
P V D L V T A S G S G,0
L P R R N R W S K I W K K V V T V F S,1
F A L L G D F F R K S K E K I G K E F K R I V Q R I K D F F R N L V P R T E S,1
Y H C G V C L Q R A P A S K T L T L H T,0
A V A V V G Q A T Q I A K K W K L F K K I E K V G Q,1
S Y R S L P P A A P P T T S N R H R R Q I D R G V T H L N I S G L K,0
E A V V C G T A T V A G S R C V I A V M D F R F L G G S L,0
L C Y C R R R F C F C V,1
L N P I N Y S V L A G L I P K N Y P G R V H E I V A I L I Q E,0
G K S G H G I H C L G V R V G K Y V L,0
A C T R K A W F W A M D,0
K N W K G I A G M A K K L L G K N W E L M E K,1
R K R T E F A G A K F K E S K V F E A N E E A L,0
K Q L I R F L K R L D R N L W G L A,1
L S L R R S M Q S A M I K D D L I F W L V R E L E D P D H L,0
G I G K F L H S A G K F G K A F L G E V M K S,0
D T I L V S V M H V N N E I G T V N D I A A I G E L T R S R G V L Y H,0
F L G A L W N V A K S Y F A M D,1
I L G P V I S T I G G V L G G L L K N L,1
R G G R L C Y C R R R F C V C Y,1
P V C T R N G L P V C G E T C V G G T C N T P G C T C S W,1
G I M S S L M K K L K K H I A K A M D,1
L C Y C R R R F C V C V G R,1
R G G R L C Y C R R R F C V C A,1
A T C P N A T L T T F G P D V G L P S G Q M G N S E V,0
K R G F G C N G P W N E D D L R C H N H C K S I K G Y K G G Y C A K G G F V C K C Y,1
R I S L I Q D M R H I Q N,0
L L G M I P L A I S A I S S L S K L,1
F N L R D F A N I F Q G,0
R G G R L C Y C R R R F C V C V,1
V I L L V V V T C G A F M,0
V C G E T C F G G T C N T P G C S C T W P I C T R D G L P,1
I W R I F R R I F R I F,1
I L P W K W K W W P W R R,1
G F M K Y I K P L I P H A V K A I S K L I A M D,1
C G E S C V W I P C I S A A V G C S C K S K V C Y K N G T L P,1
F I Q Y L A P L I P H A V K A I S D L I,1
F F P G I I K V A S A I L P T A I C A I T K R C,1
L V E P L Q L C H E S L H A C G M G V I A D,0
V N W G E I D F L I I D T P P G T S D E H,0
G L K A L K K V F K G I H K A I K L I N K H V K,1
F L R S L L R G A K A I Y R G A R A G W R G A M D,1
L E T Y T P D S I S A L H N I R N Y L V E,0
A T V T K R K P T C P R E N Q T E I N K P K A K R C L N S A V,0
G V W D W L K K T A K N V W N S D I V K Q L K G K A I N A A K N Y V A E K I G A T P S A M D,1
G L N A L K K F F Q G I H E A I K L I N N H V Q,1
G I G K F L H S A K K F G K A F V G E I M N S,1
L F A S Q R L I S G K V D D A D L N S Y H S,0
K S T V G Q K L K K K L N Q A V D K V K E V L N K S E Y M C P V V S S F C K Q H C A R L G K S G Q C D L L E C I C,1
R V R R F P W W W P F L R R R A M D,1
A C T K W K S F L K T F K S L K K T V L H T L L K A I S S A M D,0
M P K W K V F K K I E K V G R N I R N G I V K A G P A I A V L G E A K A L G A M D,1
K R R K L A F R L F R L F L K L V L K K A M D,1
W C Y C R R R F C V C V G R,1
R R W P L L P W K W P L I,1
T K P K G T K P K G T K P K G T K P K G A M D,1
Q G L E D S K R S K S L L P D H T S D,0
R L G N F F R K A K K K I G R G L K K I G Q K I K D F L G N L V P R T E S,1
A D T A A S A I A V A L E A Q K F V V,0
P R Y D G H C R N Q S L P D S G I P Y V I R F R N P D A G I V S,0
S W K S F L K T F S S A K S T V L H T A L K A I S S,1
G L F G K S S V W G R K Y Y V D L A G C A K A,1
G I G K F I H A A K K F G K L F I G E I M N S,1
L L R R L L R R L L R R A M D,1
C G E S C V Y I P C L T S A V G C S C K S K V C Y R N G I P,1
L L I I L R R R W R K Q A R A R S K A M D,1
Q Q L K E E R Q V D P L N E D V L L A M E D M G L D K E Q,0
N N L L R A I E A Q Q H L L Q L T V W G I K Q L Q A R I L A V E R Y L K D Q,1
Q Q N L A V S E S P V T P S A L A E L L D L L D S R T I,0
I I E G I G P R Y C P S I E D K V M R F A,0
Y C Y C R R R F C V C V G R,1
G F M K Y I G P L I P H A V K A I S K L I,1
S I F V V P V K S S D M L L N E C L K I A K T,0
A D E R R E F A V S M L R D,0
G L P A L I S W S K R K R Q Q A M D,0
E E I K E V L A G D I A A A I G L K D T T T G D T L C A E N S F I,0
V F Q F L G K I I H H V G N F V H G F S H V F,1
D D Y F T I L R G R Q L A A S A N D L E A R V Y L P,0
I L G P V L G L V S N T L D D V L G I L A M D,0
G I A K F G K A A A H F G K K W V G E L M N S,1
Y D V K Q Q R L L L A Q E E Y N H L N K,0
H G G N H A S I Q A A I D A V R G G E S V N S A D A E G Q R,0
G F F A L I P K I I S S P L F K T L L S A V G S A L,1
L C Y T R R R F T V C V,1
N I T A R F N R Y R R M L,0
I L P L K W P W W P W R R,1
S R R Y P G V Y T D V H Y V K P F I,0
C I G A V L K V L T T G L P A L I S W I K R K R Q Q,1
D K Y R V L A G N D G T V S Y L S L L D Q L,0
F V P W F S K F L P R I L,1
G V W G I A K I A G K V L G N I L P H V F S S N Q S,0
F F H H V F R G I V H V G K T I H R L V T G A M D,1
A E S Y P G L T V D Q L S L E Q L Q N F,0
F F H H I F R G I V H V G K T K H R L V T G A M D,1
I L G K I W E G I E S L F A M D,0
S D C I T N E I L V R F T E A L E F N T V,0
V T E V A W Q A H F V K N M F I R P T E E Q L K N,0
I L P F K F P F F P F R R,1
A K E G V F L P P S Q F E G T F L S T A H T K D D I E K T I Q A,0
A K D Y A I E G G S V L H L V L A L R G G L L M,0
H D V L Y E P P V G I T I A V P K P T,0
K L L K F V T K V G K A I F K A L I K A I,1
G I F P K I I G K G I V N G I K S L A K G V G M K V F K A G L N N I G N T G C N N R D E C,1
R I I K C G Y R D G D N A P M A I V,0
G I W D T I K S M G K V F A G A I L Q N L A M D,1
G T S T M S G H Y V C H I K K E G R W V I Y N D H K V C A S E,0
I G D L V K W I I D T V N K F T K K,1
G I G A V L K V L S T G L P A L I S W I K R K R Q Q,1
W K W K P G K W K W A M D,0
R K A E Q A A A E Q A L K Q L E L E M T T M L,0
M Q I F V K T L T G K T I T L E V E P S D T I E N V K A K I Q D K E G I P P D Q Q R L I F A G K Q L E D G R T L S D Y N I Q K E S T L H L V L R L R G G,1
K R R K K D D I S L E E L F Q S L P R E K D Y F M M D A,0
R R R R R R A A F A A W A A F A A,1
I S M R I V E Q Q T E,0
K W K V L K K K I K M L R N R I N G L V K A G P A L K V K L Q A L A L,1
C G E S C V W I P C I S S A I G C S C K S K V C Y R N G I P,1
G I F S K L A G K K I K N L L I S G L K N I G K E V G M D V V R T G I D I A G C K I K G E C,1
H Y R I K P T F R R L K W K Y K G K F W,1
A C T K W K S F L K T F K S L K K T V L H T L L K A I S S A M D,0
R F R R L R K K F R K R L K K I A M D,1
R G G R L C Y C R R R F C V C L,1
G F R E K H F Q R F V K Y A V P E S T L R T V L Q T V V H K V G K T Q F G C P A Y Q G Y C D D H C Q D I E K K E G F C H G F K C K C G I P M G F,1
G L L S G V L G V G K K V L C G L S G L C,1
S D P H P R S G S S R K N D S I A K S Y E F H L Y T M V A D T H Q R G T,0
F F G W L I R G A I H A G K A I H G L I H R R R H,1
D N T D S V V K I Q S W F R M A T A R K S Y L,0
T L L D W V K H L Q K N L N A G V L D S F S V T M,0
I L P W K W P W L P K R R,1
L D S L G M R P K A V N I R T M P,0
G V F D I I K G A G K Q L I A H A M G K I A E K V G L N K D G N,0
E E R R G I H Q D A P E F A D Q S T E A E V L V,0
A A K K G S E Q E S V K E F L A K A K E D F L K K,0
A F H P L A G V D R V Q L R D A A M L A S L A D P T P E,0
K T Y D K R E S I A K K D Q E R N L,0
T Y A G S K A F L S G W S Q A L G E E V K R S N V D V S,0
K I R F T R T V S R L L K A A L A S T,0
Q A I V G G N F D E T Q V S S A A M K A W L A F W A S,0
Y Q V L Q A G G F T S G G T N F D S K,0
T S R C I F Y R R K K C S,1
Q D E K E R N I R A G L N Y G H T F G M L I E N E T N Y E R F L H G E,0
A C T A L A S L L K T L S K A A K K A L K T L L K A L S A A M D,1
G I I K K I I K K I I K K I I K K I,1
F F G W L I R G A I H A G K A I H G L I H R R R H,1
K L L K L L L K L W L K L L K L L L,1
A C T R G G R L C Y C R R R F C V C V G R A M D,1
F F K K F W G G V K A I F K G A R K G W K,1
G L K E I F K A G L G S L V K G I A A H V A S,1
K W K S F I K K L T S A A K K V V T T A K P L I S S,1
E S E E E R M K F F R E Y G L K Y E L E K L R V D L E N,0
H A E H K V K I K V K Q K Y G Q F P Q G T E V T Y T C S G N Y F L M,1
W K L L S K A Q E K F G K N K S R,1
V I S L Q K L I V R E V A N E E K A M F L,0
I L P W K W P W W P L R R,1
I F R I D E E A I K A H L P V P P Q G,0
L P E P F D P H R P Y V D Q V E L A C A C G G T M R R V P Y V,0
K M E D I V A S I K A G Y E C G K K H N I I V L A E,0
F F H H I F R P I V H V A K T I H R L V T G,1
E L A T Q I F E E A R K F T Y R S W V R P C V V Y G G A P I G N Q M,0
G L L S G I L G A G K N I V C G L S G L C,1
W Q T Y V D E H L M C D I D G Q G Q Q L A A S A I V G H D G S V,0
S D M L A N P R R P I A Q W H S L K P E E E V D A L L G K N K M G,0
Y L N R G H M L R A H T S A H Q W D L L H A G L N A,0
S K V W R H W R R F W H R A H R K K,1
K W K V F K K I E K M G R N I R N G I V K A G P K W K V F K K I E K A M D,1
G L F S K F A G K G I K N L I F K G V K H I G K E V G M D V I R T G I D V A G C K I K G E C,1
F F H H I F R G I K H V G K T I H R L V T G,1
R A P S M I D E F P I L S,0
Y E E K N V P K I D R P F E F F M N R F R L L E A V P K Q E F E D Y T,0
K N W K G I A G M A K K L L G E N W E L M,1
E K I F Q N P T D E E S T,0
Y I P D G G P D G G D G G D G G S V Y L,0
R I V V V D L H N P S I Q G F F N I P V D,0
P A I C Q R A T A T L G T V G S N T S G T T E I E A A I L L,1
Q S R V I Q G L V A G E T A Q Q I C E D,1
I E R A H R I S L L I E R A L,0
G D Q K K D A N L I G Q F G V G F Y S A F I V A D Q V D V Y S,0
R L R R I V V I R V R R A M D,0
F P T Q L A R H I K F G Q K S H V E C,0
Q I D R L S K R R K T E E D L R E E I E S L Q E N I L,0
G S L P L C M L L E R T G A S E,0
I L G P V L G L V G N A L G G L I K K L A M D,1
Q A L S S G A T V E Q A R Q E L V A K I G E N I K L R,0
N R E D A A Q A A E E R S E T R T P P E A,0
L K Q E A D A K L K K E N D D K L K Q E A D A K L K K E K H D K L K Q E,0
R R F P F F P F K F P L I A M D,1
F S P Q M L Q D I I E A A T A I L,1
T T S I R R R Y Q V S L I R R H R G K R,0
L R R L W L R A N R L L R R L W L R A N R L A M D,1
F F R L L F H G V H H V G K I K P R A A M D,1
G L P V C G D T C V G G T C N T P G C T C S W P V C T R N,1
I E V V L Q V L S I S A I T T T,0
G I G K F L H A A K K F A K A F V A E I M N S,1
R F G R F L R K I R R F R P K V T I T I Q G S A R F G,1
Y T Y R G L S E S P V E N K S I G D T L R K P P Q K E,0
G K K L F K K I L K Y L A G P A T T G L P A L I S W,0
L I R G L F K S F W Q V F A M D,1
G K P R P Y S P R P T S H P R P I R V,1
C G E S C V F I P C I S T L L G C S C K N K V C Y R N G V I P,1
F F H H I F R P I V H V G K T I H R L V T G,1
S A V W R R W R R F W L R K R R K R,1
F T I Q Q G F P Y H K M K L L V A A V G R W R G G P E R A L F,0
P V T L F T K G G G Q W L E A M A E T G C D A L G L D W T T D I,0
K W K S F L K T F K S P A R T V L Y T A L K P I S S,1
D S H A K R H H G Y K I K F H E K H H S L R G Y,1
V R R F K W W W K F L R R,1
G L K E I F K A G L G S L V K G I A A H V A N A M D,1
L Q R R Q S F A V L R G A V L G L Q D G G D S N V A S E A D S E P,0
G L W S K I K T A G K S V A K A A A K A A V K A V T N A V,1
G N C N D S K L E F G S F W E L I G E A A K S V K M,0
M H A N N R Q E V S E I V A G D I A A C V G L K D V T T G,0
S N P L E L D K R S A E L D T A T W Q,0
L E T E V R L M G E F P P D E L A G L D G H,0
R G G R L C Y C R P R F C V C V G R,1
N R D A K K L Q D Y G D I T Y H S K K H R,0
M D F I I D I I K K I V G L F T G K,1
D A H R L A I Q G L R L L P Q A A P P A D Q P N L S V R A F G L N F S,0
L W Q K S G H W D N Y Q D A M F F T E S E K R T Y A,0
V I T V L T A D F A Q P N G Y G R I V K D G D G F I K R I V E E,0
R G G R L C Y C R R R F C V C I,1
K G I E V V L M Y D R I D E Y V,0
D M V T V A Y A V S Q I T K F T G R E K P S V V T M E,0
C K V A S L E G N K V T L V G E E M A G F G L P N F G Q L T E A F,0
G R D Y R T S L T I V Q K L K K M V D,1
M Q F I T D L I K K A V D F F K G L F G N K,1
G I F S K I N K K K A K T G L F N I I K T V G K E A G M D V I R A G I D T I S C K I K G E C,1
G A G A L A K F L A K K V A K T V A K Q A A K Q G A K Y V V N K Q M E A M D,1
H L I D N K K T D N T A D E I Q T T P E L S E W E L A Q D E F N A W F K,0
G L P V C G E T C V G G T C N T P G C T C S K P V C T R N,1
G L N A L K K V F Q G I H E A I K L I N N H V K,1
I L P W K W P W L P Y R R,1
G S K R W R K F E K K V K K A L E D A K E K L Q E E R V Q K I V E H T K E A L P V I K A V A T V V G V V G R R,1
A V F L M V K H P H V Q G R,0
A R I V Q R I K D F L R A M D,0
M Q F I T D L I K K A V D F F K G L F G N K,1
F F H H I F R A I V H V P K T I H R L V T G,1
R G R G K Q G G K V R A K A K T R S S,0
M A S R A A R L A A R L A R L A L R A L,1
T Q L L W A A Q N R G E K I L C E G A Q,0
A R R L L M S K V T F K V T L T S D P R L P Y K V L S V P E S T P F,0
R A F D H Y W P R F G V,0
R V W Y K G D Q K Q V Q H A C P T P L I A L I N R D N,0
R A K I F K K I E K V G R N V R D G I I K A A M D,0
Y D S A T P I S T E T G T E I M T A T V L L E V P F S A R G D R,0
