text,labels
G V C G K A S L Q A V S Q V S R F A P G G D P A,0
F L P W F S K F L G R I L,1
S A V W R H W R R F W L R K H R K H,1
D S H A K R H H G Y K R K F H E K H H S H R G Y,0
E P D D G I A A I G S G G P Y A L A A,0
G I G K F L H S A K K F G K A F V A E I M N S,1
L K W N L A V I Q L F S A E G M D T F I R V L Q K L N S I L T Q P W R L,0
G L W S K I K T A G K S V A K A A A K A A V K A V T N A V,1
R A G L Q W P I G R L L R R L L R R L L R,0
K R K L I F L A A F L A A L A L F K K R A M D,1
K N W K G I A G M A K K L L G K N W E L M E K,1
A C T K W K S F L K T F K S A K K T L L H T A L K A I S S A M D,1
A C T A L K S L L A T L S K A A K K A L K T L L A A L S K A M D,1
F D W D S V L K G V E G F V R G Y F,1
S K V W R H W R R F W H R A H R K L,1
V I T N M K F P G Y M L I V,0
G V P C G E S C V F I P C I T G V I G C S C S S N V C Y L N,1
N L M S S V L P D G T T T C,0
D Y R V E G D Y S Q A A F F F C A D A L S S N I V L,0
K K A A A A F A A F A A W F A A F A A A A K K K K,1
L C Y C R R R F C V C V G R,1
G L G S L L G K A F K F G L K T V G K M M G G A P R E E,1
G A G N N T I N R L Y N I G V E G A D T V A I N T D K Q H,0
F F R N L W K G A K A A F R A G H A A W R A,1
P P E G F N L R R D V Y I R V A S L L K T L L K T E E W V L V L P P,0
G L W S T I K Q K G K E A A I A A A K A A G Q A A L G A L,1
A A C V L G P G R I A S L A A L D D S K K L,0
A C T K W K S F L K T F K S L K K T V L H T L L K L I S S A M D,1
Q G V L A N A A T R F A V G D T L K V,0
G V L G T V K N L L I G A G K S A A Q S V L K T L S C K L S N D C,1
G L K K L I S W I K R A A Q Q G,1
R F R R L R W K T R W R L K K I W W P F L R R A M D,1
R L V R I L V S K R P V A I K P Y F R L,0
Q Q Q R P S A T P S F P R L V R N T T A N L S L S D F Q V L N P,0
Y S M G V R E Q I I F P E I D Y,0
E E Q M A A E C L Q I N D L I L S V Y K D F G F E E I T I K L,0
S C C A L V G G E T A E M P G M Y H A G D Y D L A G F C V G V V E,0
K A M G Y I G F Q A Q D I E D S L R Q R K F N E T M A S Y,0
G I G K F L H T L K T F G K K W V G E I M N S,1
I C E Q V G D P A T S K G P,0
S A V G R H L R R F L L R K H R K H,1
G L L D F V T G V G K D I F A Q L I K Q I A M D,1
G L W S K I K T A G K S V A K A A A K A A V K A V T N A V,1
T D D P V E A I E Q M E I E L S R L T E E L T S R E Q K L V I S S R S V,0
A C T A L K S L L A T L S K A K K K K L K T L L A A L S K A M D,1
V E P L W R F V N D T K D K R M L V Y K S E D I K D F S R L Q S P K V C,0
G I W K K W I K K W L K V L K N L F A M D,1
I L P L K W P W W P W R R,1
M V C V I A S K S K S D G L K F E I T K K I P I S K C K L K A L P G D M V S V H Y T G S L A E N G K V F D S S L R R N E P I Q F K L G A G Q V I A G,0
R Q I K I W F Q N R R M K W K K,1
S A V G R H G R R F G L R K H R K H,1
K K L F K K I L K Y L A G P A K F L H S A K A G P A K D W E H L K D W E H L K D W E H L K D E L,0
W F G E S E A N V R E I F D K A,0
V R R F A W W W A F L R R,1
K W K L F K K I E K V G Q N I R D G I I K A G P A V A V V G Q A T Q I A K,1
L H N F N S K I Q A V V Q H S G V K,0
R I Q E N G S L I T I L V I A G V F W V H R L I K F I Y N I C C Y,0
K K K K K K A A F L A W A L F A A,1
Q A E Q C R K I S A S L Q S Q S P E H L L P V L I Q A A Q L C R E K,0
G F M K Y I G P L I P H K V K A I S D L I A M D,1
A C T K W K S F L K T F K S L K K T V L H T L L K A I S S A M D,0
V R R F P F F F P F L R R,1
K I V V E A F D D P D V K N V T C Y V S R A K T G G I,0
A L I E A L E K A K A L N K A V H I L G L L S P G G V H S R D N Q,0
F R R F R K W F R R F L K L F A M D,1
F D E S L K S K D F V K L I N K R L S Q K I N A T N E D D W N L L E,0
T E P G I K G D T A T G A T K S A T V E T G Y T L N V P L,0
S T L A S E G S Y G E K G V E S F T Q I S K E A G G L C I A Q S,0
A C T F K K L K K L F S K L W N W K A M D,0
K W K S F L K T F K S L K K T V L H T A L K A I S S,1
A F C H T R T N D Y K S D K P S G K Y A S S T L I R K M I F E G,0
N N K F N H F I M T K L A E A G I P T Q M E R L L S D,0
Q A D F Q K V V A G V A N A L A H R Y H,1
F L G L L F H G V H H V G K W I H G L I H G H H,1
S G E V M I S A L G D P R G N G K G G F V L L D G E T F E V K G T W E Q,0
R G G R L C Y C R P R F C V C V G R,1
P A I C Q R A T A T L G T V G S N T S G T T A I E A C I L L,1
A C T G L K A L K K V F Q G I H K A I K L I N N H V Q A M D,1
A G P L V R S S Y H A D E Q V N E,0
C G E S C V W I P C I S A A V G C S C K S K V C Y K N G T L P,1
G W K D W L N K G K E W L K K K G P G I M K A A L K A A T Q,1
Y V E M S A K E H E F A C E,0
G K M K E Y F K K F G A S F K R R F A N L K K R L,1
L V R Y G K Q T M T G A I K D G L S A M S R Y Y L N N F Q D G V R Q,0
R A Q A A L A R D M G P P T F P E D V P A L Q R E L E R L R A E,0
A K A L R D A G L A V R D V S E L T G F P,0
E Q N E Q A Q D I Q N E Q V E Q S N E Q,0
A M K S L D I M L S H G T T T,0
F L P L L A G L A A N F L P K I F C K I T R K C A M D,1
R R W R I V V I R V R R A M D,1
C K K I G A V L K V L T T G L P A L I S W I K R K R Q Q K K C,1
C G E S C V F I P C I T S L A G C S C K N K V C Y Y D G G S V P,1
C I G A V L K V L T T G L P A L I S W I K R K R Q Q C,1
C G E S C V W I P C I S A V V G C S C K S K V C Y K N G T L P,1
A C T K W K S F L K T F K S L K K T V L H T L L K A I S S A M D,0
T R S S R A G L Q W A V G R V H R L L R K,0
N P W T T P P E A A Y D L T V S L E D A P D T P D I V E I T F D A G,0
S A A S N R I P A I A G T G S N N T E E A L L M T R A A K M,0
S K K L F K K I L K Y L A G P A K K L F K K I L K Y L K D E L,1
A C T A R K K W F W A M D,0
L D T Q M F G L Q K E V D F A V Q L,0
R R W P W W P W K W P L I,1
A Y R I P A I A G E R R Y G T I Y Q G R L W A F A M D,1
I S A S A E E L R Q R L A P L A E D V R G N L R G,0
C G E S C V W I P C I S A V V G C S C K S K V C Y K N G T L P,1
H A E H K V K I K V K Q K Y G Q F P Q G T E V T Y T C S G N Y F L M,1
A W A S F F K K A A H V A K H V A K A A L T H Y L,1
G L P A L I S W I K R K R A M D,1
L R A D V A L T T A S V T L P S D G E,0
L N K L L G S V V I S Q G G V L P H I M A E L,0
P M P V S Q E C F E T L R G H E R I L S I L R H Q N L L K E L Q D L A L Q G A K E R A H Q Q,0
F L F S L I P K A I G G L I S A F K,1
A C T A L A S L L K T L S K A K K K K L K T L L K A L S A A M D,1
Q G L E D S K R S K S L L P D H T S D,0
F V Q W F S K F L G R I L,1
A N A I E F D V D F D D D G V A K Y,0
V R R F G W W W G F L R R,1
F F H H I F R G I V H V G K T V H R L V T G A M D,1
A C T K W K S F L K T F K S A K K T V L H T A L K A I S S A M D,0
F G K N T T I S V K G R H D P C V G I R A V P V G E A M M N C V L L,0
V D L E P G T M D S V R A G P F G Q,0
F A E V P K L C G H I H L P A Q S G S D A V L A R M,0
I M G C Y G L G I T R V V A A A I E Q,0
V Y F S S E S H S R S D E A E N L K M M Y E D M K S R V E H V V,0
W R P G R W W R P G R W W R P G R W A M D,0
V C G E T C F G G T C N T P G C S C T W P I C T R D G L P,1
G F G T I L K A L A K I A G K V V K K L A T K P G A T Y M L K E N L K,1
K K L F K K I L K Y L G I G A V L K V L T T G L K D E L,1
G V L S V T V P A K K V D,0
R G G R L C Y C R R R F C V C R,1
G W W R R T V D K V R N A G R K V A G F A S K A C G A L G H,0
G L N A L K K V F Q G I H K A I K L I N N H V Q,1
G C A S R C K A K C A G R R C K G W A S A S F R G R C Y C K C F R C,1
I V C P L I Q N D G A Y L L C K M A D D R G V F P G Q W,0
R A D L A P G S K G L L L E D N P S I R A I S L G H G H I L,0
K A G A E A A L A A S I F H Y G E Y,0
L R L E Y R R F E Y R V,1
G V G K F L H S A K K F G Q A L V S E I M K S,1
E A A Y C N H L D V L R L L S K T T L T C L G D F K Q L H P V G F D S H,0
Y R M W R W R W R W R A M D,1
H N K Q E G R D H D K S K G H F H R V V I H H K G G K A H,1
E Q E E N V V K I Q A F W K G Y K Q R K E Y M,0
G F G T I L K A L A K I A G K V V K K L A T K P G A T Y M L K E N L K A M D,1
W L N A L K K V F Q G I H E A I K L I N N H V Q A M D,1
G N N R P V Y I P Q P R P P H P R L,0
K W K L F K K I E K V G Q N I R D G I I K A G P G I G A V L K V L T T G L,1
G F L F G A P V A L G L G V G F V P V R K P R K L P R E T I,0
E T G G E F G K G V I R A E L D V K P D L W F F G C H F,0
G F G T I L K A L A K I A G K V V K K L A T K P G A T Y M L K E N L K,1
R G G R L C Y C R R R F C V C W,1
I K I T H S N K L R E T L A D V L,0
I L P W K W P Y L P W R R,1
G L P V C G E T C V G G T C N T P G C T C S W P V C T R N,1
M E S V S V A V Q L M L G F G T F V L M L L G L V V E L I K N S N K K,1
G Q T Y A D L K A I N V N A V V N S L M K M L D F F T,0
G I G K F L H S A K K F G K A W V G E I M N S,1
G S K R W R K F E K R V K K I F E E T K E A L P V V Q G V V A V A T A V G R R,0
A A A K V R E R M Y A L I A G L D A S E V T D I V S V,0
Y A T Q L N P A F Y S V E V R I T V,0
H S P A K L E Q L I L K L D W M C L D L N Q V L K,0
L N E N T S N L A I M L E D K I L R K A R D I Y I,0
S L S R Y A K L A N R L A N P K L L E T F L S K W I G,1
L R L E Y R R F E Y R V,1
G L L R A S S V W G R K Y Y V D L A G C A K A,1
E A G L A A L R A E R A K N D R M S G R E L,0
M A A R A A R L A A R L A R L A L R A L,0
N N H E H K Q P L P S L A I A A I G V V F G D,0
G F M K Y I G P L I P H A V K A I S D L I,1
I R A V H V F R S M N E V V I P S V L Q D V P V R T S E P R K Q N L L D,0
L V Q R G R F G R F L R K I R R F R P K V T I T I Q G S A R F,1
T Q F E T D A G L E T V R G D M T E D E T R,0
K L S L L P K D K D D A R N A I L E I R A,0
L K P E M S A Y E V K D A L L E E L D K G D L D L I L L N F A N P D,0
F R R P F K W F R R F F K F F A M D,1
F P F S L I P H A I G G L I S A I K,1
I L G K I W E G I K S L F A M D,1
I L P W K W P L W P W R R,1
K W K S F L K T F K S A V K T V L H T A L K A I S S,1
V E K V R A T I V R R A A D Q K E V K K G P I N S L V P D P A T V,0
N D F M V V D A V T Q N V,0
I D M L Q I E F K C C G N N G F R D W F E I Q W I S N R Y L D F S S,0
C F R R E G R L K R D M A T S D I Q M F H H C S I H G N,0
I W V L E H P P V F T L G L A G D A G N L H S P S N Q I S L,0
I I N D T S H A R A D N C T G L K E E E,0
L L I I L R R R W R R Q A R A R S R A M D,1
A C T K W K S F L K T F K S L K K T V L H T L L K A I S S A M D,0
F H P S L W V L I P Q Y I Q L I R K I L K S G,1
F A E V P K L C G H I H L P A Q S G S D A V L A R M,0
G L P A L I S S I K R K R Q Q A M D,0
C G E S C V W I P C T I T A L A G C K C K S K V C Y N S I P,1
E K I S D L P G M P A L D A P I Y A D L H T C L E E V E A D,0
L R E L H Q L T N I D Y W F L E K L E R I I L L Q S L L T R,0
F A K M K S S A I F I N A G R G P V V D E N A,0
Q A R P D K N R D D Y D H E E D G P R K Q Q K N R S S Q N Q V R N Q,0
T A F A S A A D L K T Y L H H I E E A K K R D H R K L G,0
S L F S L I K A G A K F L G K N L L K Q G A C Y A A C K A S K Q C,1
H K T F A T P H G G G G P G A G P V A V N D K,0
K W K E F L K T F K E A K K E V L H T A L K A I S S,1
H F L G T L V N L K K K I L A M D,1
F F R L L F H G V H H G G G Y L N A A A M D,1
G R F R R L R K K T R K R L K K I G K V L K L I A M D,1
A K K V F K R L G I G A V L W V L T W G,1
F V R W F S R F L G R I L,1
P K L L E T F L S K W I G,1
G M A T A A G T T L G K L A K F V I G A V,1
G R P N P V N N K P T P H P R L,1
G L P A S I S W I K R K R Q Q A M D,0
K K L F K K I L K Y L A V A V V G Q A T Q I A K K D E L,0
S K P G I K V T K L E K L G L R M D S C C E I T F,0
D V S I L T I D N G V F E V L S T N G D T H L G G E D F D Q R I M,0
K K L F K K I L K Y L T T G L P A L I S A G P A S I L A P L G T T L Y K L I K K F L K K K D E L,1
K W K S F L K T F K S A K K T V L H T A L K A I S S,1
I L P W K W P W W P W R R,1
E T M K I K D D G Q G H L D L F L S F L N E K L L,0
A L Q E Y K P S P F Y Y F D E V D A H L D,0
C G E S C V Y I P C L T S A I G C S C K S K V C Y R N G I P,1
M E S Q S D A V Q L M L G F G T F V L M L L G L V V E L I K N S N K K,1
L C A Y V T H L P V D N Y Q T D A A V,0
A A A A A A A A A A G I G K F L H S A K K F G K A F V G E I M N S,1
E P Q R S R L Q E L A I V M N E K V G L L T E K N E K,0
E L N Y D S I N T T T T F L G K S L Q A,0
K E E P K E E P K P L S D T T Y,0
Q R I N R E K H L V L T A A H P S P L A A N R G G F F G C K V F S K,0
G I M S S L M K K L K K I I K K A M D,1
F F H H F A R G I V H V G K T I H R L V T G A M D,1
K S P K P G Q D F F P L T V N Y Q E K T Y A A G K I P G G,0
F F H H I F R A I V H V G K T I H R L V T G,1
F V G A I A A A L P H V I S A I K N A L,1
P A I A Q R A T A T L G T V G S N T S G T T E I E A C I L L,1
G W G D T F G K V L K N F A K V A G V K A A K,0
F S I S P G K V L D K F G K I V G K V L K Q L K K V S A V A K V,1
I L P W K W P L L P W R R,1
E Y A A K T E L V G K Q A M A D F E R N V M L Q A I D N Q W R E H L A A,0
R D A K E L V E L F F E E I R R A L,1
N Y H A T N P R Y H E,0
R G G R L C Y C R R R F C I C V,1
I L P W K W P W L P W R R,1
A C T K W K S F L K T F K S L K K T K L H T L L K L I S S A M D,1
G G P K S R P I E S I M A L N V K R A,0
A C T K Y Y G N G V S C N K K G C S V D W G K A I G I I G N N S A A N L A T G G A A G W S K A M D,0
G C A S R C K A K C A G R R C K G W A S A S F R G R C Y C K C F R C,1
S K K L F K K I L K Y L A G P A T T G L P A L I S W,0
K K K L F W K I P K F L H L A K K F,1
G F M K Y I G P L I P H A V K A I S K L I A M D,1
T I D D F A K L D L R V A E V R V A E A V E G A D,0
P E E E R R K W E E G R I D Y M G K D A F,0
F A L L G D F F R K S K E K I G K E F K R I V K R I K D F F R N L V P R T E S,1
Y C Y C R R R F C V C V G R,1
R G G R L C Y C R R R F C I C V,1
L L G D F F R K A R E K I G E E F K R I V Q R I K D F L R N L V P R T E S,1
T S R C I F Y R R K K C S,1
L T S T V S E K E K E M E T K I V E L K T R Y E K E L S Q L G Q E N,0
V V E R L G D Y L L D Q G M M K Y K R I V F K V G T,0
G L N A L K K V S Q G I H E A I K L I N N H V Q A M D,1
A Q A H I E Y A L Q H L Y P L A I G A T A V G T G L N A P A G F G D R,0
S L V R E S P K V L V S C F K S K T G R G L K P T S T G P G P G Y Y N P,0
K W K E F L K T F K E A K K E V L H T A L K A I S S,1
G E I L C N L C T G L I N T L E N L L T T K R K R Q Q A M D,1
R F G R F L R K I R R F R P K V T I T I Q G S A R F G A M D,1
K W R Q W Q S K W R R T N P W F W I R R,1
A S G I D P D K A T L F I Q S E V P A H V Q A G W M L T T I A S V,0
I W R I F R R I F R I F I R F,1
M S G I V E A I S N A V K S G L D H D W V N M G T S I A D V V A K G A D F I A G F F S,1
S V S N I K R Q H L T E V R S M G N P P A G V R L A L E A V C T,0
G K T L V S R T Q G T K I A S E,0
F A L A L K A L K K A L K K L K K A L K K A L,1
L Y A E F E N Y K R R I Q K E N E I N K T Y Q A Q R V L,0
I L P W K W K F F P W R R,1
G K T L V S R T Q G T K I A S E,0
G L P V C G E T C V G G T C N T P G C T C S W P V C T R K,1
A L L L K D S L R G L K K Q L N Y S D I G G A V L F G V K A P V V,0
F L F S L I P S A I G G L I S A F K,0
K K W M Q K V I D R F G G,0
E T N H T N V P I S S T G G T N N K T V P Q T S E Q E T E K R I,0
R R R R R R A A F A A W A A F A A,1
C E S C V W I P C I S S V V G C S C K S K V C Y K N G T L P,1
V F Q F L G K I I H H V G N F V H G F S H V F,1
S H G L E F I N L S T E G E N E Y K E K Q G,0
Y L A D F T T H I L Q I K I P Q R G D S T I L V E M A N T N A,0
S L K D K V K S M G E K L K Q Y I Q T W K A K F,1
R G G R L C Y C R R R F C V C T,1
M V S V S V A V Q L M L G F G T F V L M L L G L V V E L I K N S N K K,1
C G E S C V F I P C V T A L L G C S C K S K V C Y K N S I P,1
H S D G I F T D S Y S R Y R K Q M A V K K Y L A A V L G R R Y R Q R F R N K A M D,0
Q R A V Y K D L V L L L Q K D S L L,0
K M P K E Y D L F A Y P E E I N V W L I F R Q,0
T R Y T L S L M V L E R K L S S A K G A L N T L G D R I N G,0
K K A L L R A L L E P T E T L R K L E Q N G D Y T A R L A L L,0
R G G R L C Y C R R R F C V C I,1
I W D A I F H G A K H F L H R L V N P G G K D A V K D V Q Q K Q,0
R L I K L Q K H G K T V V L K L R Y S D F T T I T K R L T L N E Y T N,0
A P A V A F D H L D D M H Q A F L Q,0
P E E E R R K W E E G R I D Y M G K D A F,0
F V Q W F S K F L G K I L,1
S G G L S G A P V F E K S T E C L R L F A Q,0
R F S T Y A Y W W I R Q A I T R A I A E K A R T I R L P I H I T E K L,0
R L W D I V R R W V G W L A M D,1
E E E D L Y M I G T S E H A M A A,0
F T S E S V S E G H P D K I A D Q I S D A V L D A I L E Q,0
A S V A K S P Q T K E H L Y H A A,0
F I H H I F R G I V H A G R S I G R F L T G,1
G M W S K I K N A G K A A K A A A K A A G K A A L G A V S E A M,1
I N W K S I F E K V K N L V,1
A P V Y K E I F G A V T I H E V Q K V I K M D T E T E,0
I E S L D E V F A K K Y D E K N T I E A V E G K L F G T G I E S Y T V,0
E R R A K K S E L V A A T Y A K R F A A K E A C S K A L G T G,0
H S S G T V I L D Q L G E E H M K T G K P I F Y T S A D S V F Q I A,0
G F F G K R K E Y F K K F G A S F K R R F A N L K K R L A M D,1
G I G K F L H S A G K F G K A F I G E I M K S,1
V E Y D S F L D E N D W D I,0
L G L D W D E G P Y H Q S E R M H I Y Q Q Y T Q K L,0
I L Q K A V L D C L K A A G S S L S K A A I T A I Y N K I T,1
K V A K Q E K K K K K T G R A K R R,1
W L N A L K K V F Q G I H E A I K L I W N W V Q A M D,1
D L V I G A I N D A M A R A Q Q L A A E R,0
D S Y W Y L V G L A S W S,0
D H V A A L A R L K E E G H E V V L I T,0
G F S S I F R G V A K F A S K G L G K D L A K L G V D L V A S K I S K Q S,1
G R R K R K W L R R I G K G V K I I G G A A L D H L A M D,1
G L G S L L G K A F K F G L K T V G K M M G G A P R E E,1
M V I K K P I E V R D G N K F V R L T P T K E P,0
S A I S C G E T C F K F K C Y T P R C S C S Y P V C K,1
M S G I V E A I S N A V K S G L D H D W V N M G T S I A D V V A K G A D F I A G F F S,1
L F G V L A K V A A H V V P A I A E H F,1
T S R T R V R R S G I S P L H L A A E R N,0
G L P V C G E T C V G G T C N T P G C T C S W P V C T R K,1
K W K L F K K I E K V G Q G I G A V L K V L T T G L A M D,1
G I G K A L H S A K K F G K A F V G E I M N S,1
I L P W K W P W L P W R R,1
T E Q R N P N S M N I D Q,0
L C Y C R R R F C W C V,1
G I I N T L Q K Y Y S R V R G G R S A V L S S L P K E E Q I G K S S T R G R K S S R R K K,1
F V Q W F S R F L G R I L,1
Y V V V E I P K G E R N K Y E I A K E F P G I K L D R I I Y,0
T G E L S V K V N V L R L L T K A L R P L P D K,0
K W K S F L K T F K S A K K K V L H T A L K A I S S,1
G F M K Y I G P L I P H A V K A I K K L I,1
G S T G E A F V Q S L S E R E Q V,0
G W L K K I G K K I E R V G Q H T R D A T I Q T I G V A Q Q A A N V A A T L K A M D,0
G R F K R F R K K L K R L W H K V G P F V G P I L H Y,1
R G R I G V G H P G H,0
Q S P F T L E A N G L V L A V R L T P R A S R T G L D G V R T E A S G R P V L S L R V A A P P V E G A A N A A L T A F V A K S L G L R K A E V T L L S G E T,0
G I I N T L Q K Y Y F R V R G G R F A V L S F L P K E E Q I G K F S T R G R K F F R R K K,1
R P A F R K A A F R V M R A C V A M D,0
G L N C D A Q V L V W Q D M A G L S S G,0
R R W P L L P W K W P L I,1
E Y D V D N I L V A G P G F A K N S F Y N,0
G Y L M D E N A A M F Q E I Q L L Q E Q I N D N S Q L T Q F A,0
G K L N L F L S R L E I L K L F V G A L,1
V I W D F G L Q S S V T L V I P W I S N T H Y R,0
L C Y C R R R F C V C,1
L S F N S S N G L T N N D P E Y E D R E P R E M S K K F L N R R S,0
L V R G C W T K S Y P P K P C F V R,1
G I G A V L K V L T T G L P A L I S W I K R K R Q Q,1
L S N I K L K V E D F L N L S T Q L S G F H I C I D K G,0
I Q F G W E T I T E A L K Q G G I T,0
A C T K L K S L L K T L S K A K K K L L K T A L K A L S K A M D,1
L L I I L R R R I R K Q A H A H S K A M D,1
V W L K K Q G L L R R S A M I G L R P E D D R V Y D V I V V G A,0
G I G K F L H S A K K F A K A F V G E I M N S,1
C E S C V W I P C I S S V V G C S C K S K V C Y K N G T L P,1
D H P L L R D A I Q C R P V R E L T H S F Q,0
S R K E Q Y S N A Y A T L G E L L N R S A L P I I N,0
K W K L F K K I E K V G Q N I R D G I I K A G P A V A W V G Q A T Q I A K,1
S L R S S I K D M A A A A G R A A L N A V N G I V N P A M D,0
F L S L I P H V I S A I P H V V N A L S N L A M D,1
G G T I F D C G E T C F L G T C Y T P G C S C G N Y G F C Y G T N,1
G I F S K I N K K K A K T G L F N I I K T V G K E A G M D V I R A G I D T I S C K I K G E C,1
T G R A K R R M Q Y N R R,1
Q G W E A V A A A V A S K I V G L W R N E K T E L L G H E C K F T V K P Y L K R F Q V Y Y K G R M W C P G W T A I R G E A S T R S Q S G V A G K T A K D F V R K A F Q K G L L S Q Q E A N Q W L S S,1
I T K V I T K L L N R L S K I L S K,1
G K F S G F A K I L K S I A K F F K G V G K V R K Q F K E A S D L D K N Q,1
L K R Y I E N T I E T H I A K M F I S G E I S E G D I L K I,0
G L W S K I K A A G K E A A K A A A K A A G K A A L N A V S E A V A M D,1
L F K T P D E T T G G I T V K I A K A R E Q K G L Y,0
W L N A L K K V W Q G I H E A I K L I W N W V Q A M D,1
L I H Q G T K L I P A D F L I P I E S H N P I D N N K,0
G L F P K F N K K K V K T G I F D I I K T V G K E A G M D V L R T G I D V I G C K I K G E C,1
I L P W K L P L L P L R R,1
L V K L V A G I K K F L K W K A M D,0
R H A P W V N N I Y L I T N G Q R P K W L N V N,0
F F H H I F R G A V H V G K T I H R L V T G A M D,1
L I K R L D Q S E M V K L A E E A L N K S T A E E,0
A W K V F K R L G I G A V L W V L T W G,1
L C Y C R R R F C V C V,1
M A A D I I S T I G D L V K L I I N T V K K F Q K,1
F S Q E Q Q L M K R G L K H I A G I D E A G,0
M S V S D A V Q L M L G F G T F V L M L L G L V V E L I K N S N K K,1
R A N A L L A N G V E L T D N Q L K V P S D G L Y L I Y S Q V L,0
G F M K Y I G P L I P H A V K A I K K L I A M D,1
G F A R I V Q R I K D F L R N L V A M D,1
G G P E G L S P A C K A A A E Q S W S L,0
F F H H I F R A I V H V A K T I H R L V T G,1
P R Q L T H D A G L T V D D I A K R L M D Y G,0
D Y D W S L R G P P K C A T Y G Q K C R T W S P P N C C W N L R C K A F R C R P R,1
G L L S G V L G V G K K V L C G L S G L C,1
H G L K Q L P G L A V Q R L M Q Q G Y G F A G,0
Y S H D E M H A L R R D A I N T A K S A K K W,0
A P A V D A I W H I L N V I D D S P V A R A S L V P Y E D Y I V G,0
L Q K K N E Q K K R P K P I L L K I A P D L T D E Q L M,0
N G F K V L K K E K I H S V A A V I I L E S W F N,0
E N F F K R I R R A G K R I R D A I I S A A P A V E T L A Q A Q K I I K G G D,0
G L L R A S S K W G R K Y Y V D L A G C A K A,1
Q R N S L L R R L R E G S A T A A E L E L W D D Q L A P L,0
K R R K K D D I S L E E L F Q S L P R E K D Y F M M D A,0
E E D E M R T R V N K E M A R Y,0
A C T K W K S F L K T F K S A K K T G L H T A L K A I S S A M D,0
G I G K F I H A A K K F G K L F I G E I M N S,1
I L P W K W P W L P Y R R,1
F L G G L I K K W P W W P W R R A M D,1
L R R L W L R A N R L L R R L W L R A N R L,1
T A K A N N M P K D N I D A A I,0
M H L N I P F Y G L N L G S L G,0
A G T F V C N H L F Y G L M H E L E K H D K K I K G G F I H,0
I N E A R S Q G K K I F P K E E D V F T A F S L T P F N N V T V V I,0
F R R F F K W F R R F F K F F A M D,1
R L Y N R S G E S D V I N K R L G E A A F E I S,0
S G Y T L V H Q F C R I G A H S,0
A C T A L K S L L K T L S A A K K K K L A T L L K A L S K A M D,1
K W K L F K K I E K V G Q G I G A V L K V L T T G L,1
K Y D H L K D K A V V T Y C T G G V R C E V L S S L,0
S L H E T S T V L V E T V T,0
K W K S F L K T F K S A K K K V L H K A L K A I S S,1
K W K L F K K I E K V G Q N I R D G I I K A G P A V A V V G Q A T Q I A K A M D,0
S S S F I A C M V T I I L L L S C D F W A V K N V T G R L M V G L R W,0
K K K K K K A A A F A A A A A F A A W A A F A A A,1
K K L F K K I L K Y L A G P A K K L F K K I L K Y L A G P A K K L F K K I L K Y L K D E L,1
F R T L A Q D V L G T T Q V P Y G D E V F D F G K P F,0
W R P G R W W R P G R W W R P G R W A M D,0
I T E P D I L A S L D E L I G R W A K E R E A G,0
L L A Q V D A S I G G K T A V N H P V G K N L I G A F,0
I I V K H N L D S F E S A S S T I Q S,0
G I K E F A H S L G K F G K A F V G G I L N Q,1
A C T F K R I V Q R I K D F L R G I G K F L H S A K K F A M D,1
S R S E K A G L Q F P V G R I G R M L K K,0
G L L D F V T G V G K D I F A Q L I K Q I,1
C G E S C V W I P C I S A A L G C S C K N K V C Y R N G I P,1
K N V N S I V K I Q A F F R A R K A Q D D Y R,0
K L L K L L L K L W L K L L K L L L,1
H G P E I L R K A I K A G V P K N T,0
N L I H G R D G E D G K I A A L F E F Y S I K F I G P R,0
G L N A L K K V F Q G I H E A F K L I N N H V Q,1
R R G W V L A L Y L R Y G R R,1
M K L S C L L L T L A I I F V L T I V H A P N V K A K A L A D P E S D A V G F A D A V G E A D P F D I T,1
A C T T R K K W F W A M D,0
K W K V F K K I E K M G R N I R N G I V K A M D,0
G L P A L I S W I K R K R Q Q G,1
T V V R R R G R S P R R R T P S P R R R R S Q S P R R R R S Q S R E S Q C,0
A K Y P I K P I K L D V E N K Q V V G D L Y N G L Y R K R Q L,0
S I G T A V K K A V P I A K K V G K V A I P I A K A V L S V V G Q L V G,1
K G I T R P E M I I P E S G H S A Y D K A A Q Y F K I K,0
V R R F P Y Y Y P F L R R,1
I Y V Y N L K N M E L I N T L,0
P A L T P E L R I T A Y L P,0
I I P R L R E P K D L Y G S S S Q D G C,0
E S Y M R L N E K A L D D F C Q S L V D Y L,0
G I G K F L H S A K K W G K A F V G E I M N S A M D,0
I K M G Q G K S R E E K G T N S T N,0
F P R D Q C Y V V E V A I D E N L T K N F V C L Q T A V L H T T C N G,0
M E S Q S N A V Q L M L G F G T F V L M L L G L V V E L I K N S N K K,1
S F I K R S L K L I K S L V L I K,1
H K K S G K G T A M A Y D Q I D G A P E E R E R G I T,0
K W K V F K K I E K K W K V F K K I E K A G P K W K V F K K I E K A M D,0
E W G R R C C G W G P G R R Y C R R W C,1
V L T K I A K R N P R E I A Q A I V D H L D T S K A H V K Q V D,0
R G G R L C Y C R R R F C V C W,1
R V V R Q W P I G R V V R R V V R R V V R,0
A C T K W K S F L K T F K S A V K T V L H T A L K A I S S A M D,1
G L P L L I S W I K R K R Q Q A M D,0
F F H H I F R A I V H V A K T I H R L V T G,1
A C T E W E S F L E T F E S A K E T V L H T A L E A I S S A M D,0
V L K I A P R D L A Y F D V E A G R F R A D A G K Y E L I V A,0
A A K F L N L E A I T W A N T R D T L G K H A I,0
G F F A L I P K I I S S P L F K T L L S A V G S A L S S S G G Q E,1
P E E N N D D D E L P L V V H N R Y W R E F F G Y T P,0
E S L Q H N S V L E K I K N A I T K R V,0
R L Y R R L Y R R L Y R R L Y R,1
G K P Y G N A Y L G L R P K Y S R W L A M D,0
Q Q A Q K K G L R S R A W F K L D E I Q Q S,0
G L F E V I K K V A S V I G G L A M D,1
M K L S C L L L T L A I I V V L T I V H A P N V E A K A L A D P E S D A V G F A D A V G E A D P N A I I G L,1
G L P V C G E T C V G G T C N T P G C N C S W P V C T R K,1
G L W S T I K Q K G K E A A I A A A K A A G Q A A L G A L A M D,0
N P V L V K D A T G S T Q F G P V Q A L G A Q Y S M W K L K,1
Q R E V F I H L T D K S E T I R P E L S N A,0
T G L A D A I V D L V S T G N T L K A N N L V E V E Q I M D I S S H L,0
K A L A Q A K L S A E E V D F V E I I G G T,0
K W K S F L K T F K S A K K T V L H T A L K A I S S,1
G R A N S R N Y Y T E F A E K L P K D T V I L T A G C A K Y K Y N K,0
