text,labels
A L E D V S S S P Q S T E E V V Q S F L M A Q N V E G P S C M G I,0
D L V I G A I N D A M A R A Q Q L A A E R,0
G L L R A S S V W G R K Y Y V D L A G C A K A,1
G I I K K I I K K I I K K I I K K I,1
H I A N L C K V V A P A P S K S R P E,0
M A Q D I I S T I G D L V K W I I D T V N K F P K K,1
R A P S M I D E F P I L S,0
S K V G R H L R R F L H R A H R K L,1
E D M I A L I Q R L I D K G Y A Y V V D G D V Y,0
R G G R L C Y A R R R F A V C V G R,1
I L P W K L P W W P W R R,1
E I D F K Y A D A V T A C,0
G I G K F L H S A K K F G K A A V G E I M N S,1
R I M G D K A R P L W D A W A R Y E Y T Y G D L S,0
R R I R P R P P R L P R P R P R P L P F P R P G P R P I P R P L P F P,0
C F K F K F K F G S G F K F K F K F C,1
G I G A V L K V L S T G L P A L I S W I K R K R Q Q,1
G K G R W L E R I G K A G G I I I G G A L D H L A M D,1
R L Q S I A E V S Y E F I A S T L Q,0
A C T K W K S F L K T F K S L K K T V L H T L L K A I S S A M D,0
G L P V C G E T C V G G T C N T P G C T C S W P V C T K N,1
I L G P V L G L D G N A L G G L I K K I A M D,0
V C Y C R R R F C V C V G R,1
Y M K E E H D Y Q I I G E,0
I R D L R L G E F D V L V G I N L L R E G L D M P E V S,0
L L R R L L R R A M D,1
H A M P D A S K V A F V W L A R,0
K R R L F L F R L F R L F L R L F L K K A M D,1
I E T F L K Q L R S A A N K I V G L,0
R K R T E F A G A K F K E S K V F E A N E E A L,0
R W R S F F K K A A H R G K H V G K R A R T H Y L,1
T E Q I N G L R R E L F Q L R F Q Q A T R Q L A N T H,0
S L W E T I K N A G K G F I L N I L D K I R C K V A G G C K T,1
Q K W N R V H N L T A V R E P E A M L A L H V L D S,0
G I G K F L H K V K S F G K S W I G E I M N S,1
Y N G I R D M K K L P D V I W I V D T V R E K I,0
E A A Q I L G G N G G G R D D F A T A G G K D L S K I D E A L K Q S L,0
G I F S K L G R K K I K N L L I S G L K N V G K E V G M D V V R T G I D I A G C K I K G E C,1
G A A L A G L A K I L C L W A K E F T G A F K K L N K K F A M K K K,1
G I G A V L I V L T T G L P A L I S W I K R K R Q Q,1
A C T R R K K W F W A M D,0
V F E V S R G G D V T Y H G P G Q L V G Y P I F D L A L T,0
R G G R L C Y C R R R F C V C A,1
G I I N T L Q K Y Y A R V R G G R A A V L S A L P K E E Q I G K A S T R G R K A A R R K K,1
F V R W F S K F L G R I L,1
K K L F K K I L K Y L A G P A K K L F K K I L K Y L A G P A K K L F K K I L K Y L,1
L A L T L A P C A Q A A E P I E G K T V Y I D A G H G G,0
G F G S L F K F L A K K V A K T V A K Q A A K Q G A K Y V A N K H M E A M D,1
G I G K F L H S A K K A G K A F V G E I M N S,1
T D K K C S M Q T R R R L H Q T D Q Q D Y S,0
G W T L N S A G Y L L G K I N L K A L A A L A K K I L,1
S E C E M R Y Q D C G E A S S C T A L I E E C K T S L,0
I L P I K I P I I P I R R A M D,1
L L G D F F R K S K E K I G K E F K R I V Q R I K D F L R N L V P R T E S,1
D S K K Y K D R I S A A Q,0
R P S F D S A A P P E E G R R L Y D H F V Q A V R A K G V A T A T G I F,0
Q G E F L E S A E F A G N Y Y G T P R,0
L L G V F Q K M R I I L L G A P G A G K,0
V K I K G E E F P L T L G R D V S G V V M E C G L D V K Y F K P G,0
R R G W V L A L V L Y Y G R R,1
E K D F Q Q I L I I R R M V E D L A F,0
L L G D E F R K S K E K I G K E F K R I V Q R I K D F L R N L V P R T E S,1
C G E S C V W I P C I S S A I G C S C K N K V C Y R N G I P,1
R L C Y T R G R F T V C V,1
M L Q D W L S S L G D L L K S L L D T V N K F T K K,1
I L A W K W A W W A W R R,1
G I G K F I H S A K K F G K L F V G E I M N S A M D,1
Q Y P D A F L F F R L G D F Y E M F F D D A I K A A Q E L E I T L T S R D G G G E E R V P M C G V P Y H S A Q G Y I E Q L,0
P N M F N T R Q V G K T L I N,0
K L K E R I D T R N E L E S Y A Y S L K N Q I G D K E K L G G K L S S E,0
P T Q V K I W F Q N H,0
A V M G V P A H D E R D F A,0
M L I A L Y E H K V F V Q S V I W N I N P F D Q W G V E K G K Q I A,0
V A V T R H G G T M A D S G S V A Y L F E R K G V V E,0
P K E I V L M L C Q A F G I I Y P S F H S F I,0
G F F A L I P K I I S S P L F K T L L S A V G S A L S S S G G Q E,1
V G E R V L V E A T D L P A A G D R V W L K G Y,0
A Y H F E K Q I E D M L,0
E I A L A G S N P L S T Q D D V A A G L A K N G,0
S R S S R A G L Q F P V G R I H R L L R K,0
E E F F N T F N A L H D K,0
C G E S C V W I P C L T S A I G C S C K S K V C Y R N G I P,1
R V V R Q W P I G R V V R R V V R R V V R Y,0
E S F Q N A L K T P S K K F I N I G L K D E H G N F K Q L,0
E R R A K K S E L V A A T Y A K R F A A K E A C S K A L G T G,0
L I S W I K R K R Q Q G I G A V L K V L T T G L,1
K W K S F L K T F K S A A K T V L H T A L K A I S S,1
E A G L A A L R A E R A K N D R M S G R E L,0
H T A D V I L P A Q T G R A L A Q T,0
G I G K F I H S V K K W G K T F I G E I M N S A M D,1
G S M R K V L V W Q N L D S P R A I V,0
C D Q L G L T L L N F H P G S H L Q Q V S E E A C L A T,0
R R S G P Q R G S D L R Y N L E V S L,0
C G E S C V W I P C I S S A I G C S C K S K V C Y R N G I P,1
Y R A W R W A W R W R A M D,1
T E Q I N G L R R E L F Q L R F Q Q A T R Q L A N T H,0
F V K K F W G G V K A I F K G A R K G L K,0
A C T K W K S F L K T F K S L K K T V L H T L L K A I S S A M D,0
N Y I R R D I Y E V T R L T A S A G V S Y N K F,0
K G V H C H I G S Q I E G T E A F I E T A K I,0
V R D R E M F G Y M K L H P E D,0
K W K V F K K I E K M I R N I R N K I V K A M D,0
G S H R R F E K V L D T E R V V L I D D Y A H H P V,0
P S V V A W A L I V G G V L M W L L E S R K A T P D,0
R A Q A V R Y R G I R I D K Q P A Y N V E V,0
E I E D D E S D G M H Y V D L S K N P E R Y T,0
S N T N K A N N F K L L A E N R Y A K F Q Y A I S E T I E A G I E L,0
I N A D K N F G H S D D L A G Y Q I,0
G I L K T I K S I A S K V A N T V Q K L K R K A K N A V,1
G F K R I V Q K I R D F L R N L V A M D,1
G F R K R F N K L V K K V K H T I K E T A N V S K D V A I V A G S G V A V G A A M A M D,0
K N Q E A F V N L G V V L N T A M T G Q E S E K,0
K W K S F I K K L T S A A K K V V T T A K P L I S S,1
C A E S C V Y I P C T V T A L L G C S C S N R V C Y N G I P,1
H Y R I K P T F R R L K W K Y K G K F W,1
R H L N S K D V V I F A A G T G N P F F T T D,0
A C G L I I L Q I T V G Y R L L L L L L L,0
E E R H T F E K G S Y Y L C D V I P D K L A A I S I N T L Y,0
G F F A L I A K I I S S P L F K T L L S A V G S A L S S S G E Q E,1
M V I K K P I E V R D G N K F V R L T P T K E P,0
I C G E T C V G G T C N T P G C S C S W P V C T R N G L P,1
A S G P G G G A P R G P H G G A A S G L N G C C R C,0
G F M K Y I G P L I P H A V K A I K K L I A M D,1
C N S S A F F F S G F F V V F L S V L P Y A L M K G I I L R K,0
L S V K A F T G I Q L R G V C G I E V K A R G,0
G L N A L K K V F Q G I H E A I K L I N N H V Q,1
G I G K F I H S A K R F G R A W V G E I M N S A M D,1
V F E G S D A I I D F T V R D A F L A N Y K A M I A,0
M L S L S D A V Q L M L G F G T F V L M L L G L V V E L I K N S N K K,1
K I V A E A D A V V L A T E H S V S L H L A A W F,0
K D R P K K P G L C P P R P Q K P C V K E C K N D D S C P G Q Q K C C N Y G C K D E C R D P I F V G,1
G I G A V L K V L T T G A P A L I S W I K R K R Q Q A M D,1
R N F F K R I R R A G K R I R K A I I S A A P A V E T L A Q A Q K I I K G G D,0
E V Y G P E S S G K T T L T L E L I A A A Q R E G K T C A F I,0
L C Y A R R R F A V C V,1
K H F G R V A P H G K E W K W M M E N V L G V,0
E E E V E E P E E R Q Q T P E V V P D D S G T F Y D Q T V S,0
F S P Q M L Q D I I E K K T K I L,1
F F H H I F R A I V H V G K T I H R L V T G,1
F F H H I F R A I V H V G K T I H R L V T G,1
G I G K F L H S A K K F G K A F A G E I M N S,1
G L L S R L R D F L S D R G R R L G E K I E R I G Q K I K D L S E F F Q S,1
W K R W V Q R W K R W L R A M D,1
V V K P G R I L Y E I G G,0
M R I I G V D E S K I Y N D V,0
I K R T F N V P V I T D V H E P Y Q A E P V A K V C D I I Q L P A F,0
V S R R R R R R G G R R R R,1
G Y Y G D V T E K Q F R R S Y D D A S K L K G D T S Q,0
I L S A I W S G I K S L F A M D,1
I S G P V L G L V G N A L G G L I K K I A M D,0
I K E V R A I T N L G L K,0
G L P A L I L W I K R K R Q Q A M D,1
G I W S S I K N L A S K A W N S D I G Q S L R N K A A G A I N K F V A D K I G V T P S Q A A S,1
G F K R L V Q R L K D F L R N L V A M D,1
C G E S C V Y I P C L T S A I G C S C K S K V C Y R N G I P,1
R V L T P G T H G S T F G G N P L A I A I S T A A L D V L K D,0
P A I C Q R A T A T L G T V G S N T S G T T E I E A C I L L,1
L F N N Y I T A A L K L L E K L Y K V A M D,1
I I S A P V E A L G Y E L V G I E F I R G R Q S T L R I Y I D S,0
M A Q A I L E L Y P G S K L T I G P P V D D G F,0
E I N R P I K M M L S Q I S P D I V,0
K R I V Q R I K D W L R A M D,1
G L F G V L A K V A A H V V A A I A E H F,1
K R R I L I R I L K L I I K L I L K K R A M D,1
S A V E K D R E D F R E A V V K T L D R L L F,0
M K L G L L V V L A V A V L V P S L S E G Q N V P S C Q L K D P N Q T P V E A G N M R N K R E A D D S S E E S D L A E I,1
G P L P P S I Q T T L P T S V N L T Q L,0
G I G K F L H S A G K F G K A F I G E I M K S,1
E S E D F S V G E I K,0
F L S L I P H A I N A V S T L V H H F,1
G V P C G E S C V F I P C I T G V I G C S C S S N V C Y L N,1
L L R R L L R R L L R R L L R R,1
K W K S F L K T F K S L K K T V L H T A L K A I S S,1
I L P W K W K F F P W R R,1
L R E D K V E F S L S I E A I K K,0
T Q S E Y Y N H A I D W Q T G P G,0
L T K F G G N I Q F I E V P F T D I Q E E I K A K A P E A,0
P V E P D K I E E A N K G E N T S L L H P V S L H G M D D P,0
C G E S C V F I P C I T S L A G C S C K N K V C Y Y D G G S V P,1
H D E N H P Y R T W N Y H G S Y D V K P T G S,0
P K E I V L M L C Q A F G I I Y P S F H S F I,0
G I W K K W I K K W L K K L K N L F A M D,1
H L R R I N K L L T R I G L Y R H A F G,1
R G G R L A Y A R R R F A V A V G R,1
N S K L L N G S Q R V V M D G V I S D H E C Q E L Q R L T N V A A,0
G P Y Y P Y L G S N T K E S T S I L Q P W E K E T K V P,0
I I S T I G D L V K W I I D T V N K F T K K,1
I L P W K W P W W P A R R,1
G L G S L L G K A L K F G L K A A G K F M G G E P Q Q,1
A C T K W K S F L K T F K S A K K T V L H T L L K A I S S A M D,1
R L W L A I G R G A M D,1
A I W R K A T R R L V K L I V A M D,1
T I A T N M A G R G T D I K L G E G V R E L G G L,0
I L Q K A V L D C L K A A G S S L S K A A I T A I Y N K I T,1
G T P C G E S C V Y I P C I S G V I G C S C T D K V C Y L N,1
G A G A L A K F L A K K V A K T V A K Q A A K Q G A K Y V V N K Q M E,1
G W L D V A K K I G K A A F N V A K N F L F N K A V N F A A K G I K K A V D L W G,1
S R P N A M T V F W S K M A Q S M T S,0
T E A T G K Q C I Y L I D D F A S E L D S H R R Q L L A,0
R L V L A L A A H F K P G S S R T,0
C G E S C V F I P C V T A L L G C S C K S K V C Y K N S I P,1
A C T K W K S F L K T F K S L K K T V L H T L L K A I S S A M D,0
I W R I F R R I F R I F I R F,1
F A L L G D F F R K S K E K I G K E F K R I V Q R I K D F F R K L V P R T E S,1
V V T K H I K I V D K G F L T D R E Y Y S A F H D,0
F L R F I G S V I H G I G H L V H H I G V A L,1
A G W G S I F K H I F K A G K F I H G A I Q A H N D A M D,1
A I V M G A E G D G M R R L T R E T C D D L I K I,0
K F T I V F P H N Q K G N W K N V P S N Y H Y C P,1
G K G A L K K F L A K K V A K T V A K Q A A K Q G A K Y V V N K Q M E A M D,1
G L L S G I L G A G K H I V C G L T G C A K A,1
R R R R R R R V S R R P M R R Y R S R R P R R L V,0
R E I D A L L L E L D G T E N K S N V G A N A I L A,0
F L P W F S K F L G R I L,1
V Y F I S I G D N S R K H A M L L S E N I R S T L P S L R L M V H H G G,0
T R S S R A G L Q F P V G R V H R L L R K,0
I A V V A S F V D P K D H S F L K K L,0
T M M A D W A N D D V N L F G W R E E,0
W G R A F R R G V R R L A R G G R R A M D,0
L L R V R D D D I P G L V M D G,0
G F F A L I A K I I S S P L F K T L,1
I L P W K W P L L P W R R,1
H A E H K V K I G V E Q K Y G Q F P Q G T E V T Y T C S G N Y F L M,1
L C Y C R R R F C V C,1
V L T D V H D I D Q V A P V A A V V D,0
E G G K V T V K T E A G A T,0
I L V V A R F G N T R L L D N I W L M K T E,0
S V S K V L W L D E I Q Q A V D D A N V D K D R A K Q W V T L V,0
C F K F K F K F G S G F K F K F K F C,1
I C S L S T M Y T F L L,0
G F M K Y I G P L I P H A V K A I S D L I,1
G F S S I F R G V A K F A S K G L G K D L A K L G V D L V A,1
V A G S G T G R G S P A V T L V Q L P S G Q T V Q V Q G V I Q T P H,0
R L Y R K V Y G R L Y R K V Y G R L Y R K V Y G R L Y R K V Y G R L Y R K V Y G R L Y R K V Y G R L Y R K V Y G R L Y R K V Y G K K K K K K K,1
K N W K G I A G M A K K L L G E N W K L M,1
G L L C Y C R K G H C K R G E R V R G T C G I R F L Y C C P R R,1
G F M K Y I G P L I P H A V K A I S D L I A M D,1
I T K Q I T K Q L N R Q T K I Q S K,1
R A G L Q F P V G R L L R R L L R R L L R,1
Q F G G M L L A Y S G V Q S K K L T A M Q,0
A V G I G A L F L G F L G A A G S T M G A R S,1
K W K S F L K T F K S A K K T V L H T A L K L I S S,1
I L P W K W P F F P W R R,1
G L P V C G E T C V G G T C N T P G C T C S W P V C T K N,1
L G V T R A I S D A L G I P V I,0
I F S N T A L V N C M R Q T L Q D T G H N P,0
Q A Y A D I P S I V R R T I L D I G,0
G L P V C G E T C V G G T C N T P G C K C S W P V C T R N,1
T P D L G G K A S T Q Q V V D D V L S R L M I S S E E K V E F L,0
R A K I F K K I E K V G R N V R D G I I K A G P A V A V V G Q A A T V V K A M D,0
G L P V C G E T C T L G T C Y T Q G C T C S W P I C K R N,1
Y E R S L A V I T A A R D Y G L V T K S N L I L G M,0
G F F A L I P K I I S S P L F K T L L S A V,1
R E I S T I T P R F T V V E K D P K L A S F I R N E Y P,0
V L S A A D K G N V K A A W G K V G G H A A E,1
L A P T G M F V A T A K Y M V I Q G E P G A V I R G K K G A,0
R L G N F F R K V K E K I G G G L K K V G Q K I K D F L G N L V P R T A S,1
P P H G G L A P G I D R M V M L L A G,0
F S A L F G M E K S I F R Q L K I Y,0
V C G E T C E G G T C N T P G C S C S W P V C T R N G L P,1
S C L L P M D D A L V R C A L D L S A R P Y L I W N V,0
M L Q D L L S S L G D L L K S W L D T L N K F T K K,1
V K R I I E T E H F R V E R V I G R Y D K M I K I T,0
K R I V Q R I K K W L R A M D,1
F F H H I F R P I V H V A K T I H R L V T G,1
V Q W R I R V A V I R K,1
I L P W K W P Y L P W R R,1
V I P S L C T D D K G Q L,0
K A A C A A H C L W R A M D,1
M V H E E L N N K P Y V I N D L V G A,0
M L S V S D A V Q L M L G F G T F V L M L L G L V V E L I K N S N K K,1
D P V S K I F F E Q G T Y Q C L E N C G T V A L T I,0
I P A T I R Q Q P P S V V A D T,0
G F M K Y I K P L I P H A V K A I S K L I,1
G L F G K S S V W G R K Y Y V D L A G C A K A,1
I I V L D S K R S N A I N I G L T V,0
I L S T T L V Y S V V Y G Y R F W T G F G L P G S A F P,0
L L G D E F R K S K E K I G K E F K R I V Q R I K D F L R N L V P R T E S,1
G I G K F L H K V G S F I K S W K G E I M N S A M D,1
F F S L G N L W A I I S S L A T Q R Q A E G I L N L I E A K W E,0
A V S V T F M D S Q D T P I F E P L P,0
C G E S C V Y I P C L T S A V G C S C K S K V C Y R N G I P,1
F S E A I K K I I D F L G E G L F D I I K K I A E S F,0
K W K S F L K T F K S A K K K V L H T A L K A I S S,1
F G I S A R S V T V S T V G L A P A I R K L A D E R L G V T L A L S L,0
V T V L L K A L G W T T E Q,0
G I G K F L H S A G K F G K A F I G E I M K S,1
L S E M N M V V E G I Y T T K S V Y H L A K E K N V D M P I T N A L Y R,0
M S D F V N A I S E A V K A G L S A D W V T M G T S I A D A L A K G A D F I L G F F N,1
I T P I A D F H S K V I S V E F N K,0
G L G S L L G K A F K F G L K T V G K M M G G A P R E Q,1
I W R I F R R I F R I F,1
V Q R C A S S V A I L Q Q Y F S N T I S R L L L P V,0
A I R I T H L P T G I V V E C Q D E R S Q H K N,0
S C Q A L I L A P T R E L A Q Q I Q,0
R A G L Q F P V G R V H R L L R K,0
S E L N I L A E G P V I A I H Q P E S E L A K M D E,0
V K W M L E S L A I A R Y M,0
L K D V E E A Q Q K I I N I I R R L,1
F R R P F K W P R R F F K F F A M D,0
D E K Q F I S M V N E G A F I E H A K V F N H W Y,0
