text,labels
S N K M T D R E R D K V M P L I I Q G F K D A A E E A G T S V T G G Q T,0
G R R P R P R P R P W W W W W,1
K W K L W K K I E K W G Q G I G A V L K W L T T W L A M D,1
K K K L F W K I P K F L H L A K K F,1
E Y N P G D G A F Y G P K L D F V V K D A,0
G L L S G I L G A G K H I I C G L S G L C,1
G F F A L I A Q I I S S P L F Q T L,1
I G Q G A S G G V Y T A Y Q H G T,0
T P I A Q I L A I R E L N I G H S L I,0
A I S D I P F N G P I A G V Q V G Y V N G E L I I N P D Q A Q Q E A S L,0
E I D S F V D G I D L S E T L T R A K F E E L N L D L F,0
F L R A M P Q V V N G T K H G,0
G I L K T I K S I A S K V A N T V Q K L K R K A K N A V,1
S H L K R P V F A A I F I F W R A S Y N I G I G I L,0
G L P V C G E T C V G G T C N T P G C N C S W P V C T R K,1
R R S K A R G G S R G S K M G R K D S K G G S R G R P G S G S R P G G G S S I A G A S R G D R G G T R N A,0
A C T K W K S F L K T F K S A V K T V L H T A L K A I S S A M D,1
A E N S N T A K H A A E F W,0
I N Q K K I A S I G K E V,1
D M I T D L D F E T L Y Q Y M L S D K K N D K Q,0
S A I S C G E T C F K F K C Y T P R C S C S Y P V C K,1
A L R E S L V P L N K K Y P I A E L M E S C A,0
G S T S F H L I Y N K W F A V K R R R K R,0
C A E S C V W I P C T V T A L L G C S C S N N V C Y N G I P,1
T L G I I F F A I F F R E P P R I S,0
V E P P E N P L F V L S D H H D F T D E E,0
F V Q W F S K F L G K I L,1
L V E D P Y T E K E S R M H V I R M R E L V G A A G,0
M D F I I D I I K K I V G L F T G K,1
R R I H I H I P G I H I H I R R A M D,0
R H W M A N K Q Y V F T K E E V A K L A K Q Y,0
G M S A Q K P G L H P R N R H Q H R Y D L,0
M I T I S T M L Q F G L F L I A L I G L V I K L I E L S N K K,1
G L P A L I S W I K R K R G G A M D,1
G A D E K F L E R V E E E E L T V D G L P E,0
N R F T A R F R R T P W R L C L Q F R Q,1
Q K K P W E S M A K G L V L G A L F T S F L L L V Y S Y A V P P L,0
A K K V F K R L G I G A V L W V L T W G,1
F F H H I F R P I V H V A K T I H R L V T G,1
W K R I V R R I K R W L R A M D,1
G F F G K M K E Y F K K F G A S F K R R F A N L K K R L,1
S A V W R W R R F W L R K R K,1
A W A S F F K K A A H V A K H V A K A A L T H Y L,1
P R A L L F I S Y A A N Q A V L A A,0
C A E S C V Y I P C T V T A L L G C S C S N R V C Y N G I P,1
A V A V V G Q A T Q I A K K K L F K K I L K Y L K D E L,0
F G G C I V A L V P P A L V D D V K A T V A A K Y Q A A T G L,0
S G G L S G A P V F E K S T E C L R L F A Q,0
L D P I V A K R V R H I L T E N A R T V E A,0
A R A V A G S D L S R R I E L D G P,0
I L Q Q D F C H A I K V G V K Y T Q Q I I Q G,0
Q G W E A V A A A V A S K I V G L W R N E K T E L L G H E C K F T V K P Y L K R F Q V Y Y K G R M W C P G W T A I R G E A S T R S Q S G V A G K T A K D F V R K A F Q K G L L S Q Q E A N Q W L S S,1
F R W C F R V C Y K G R C R Y K C R,1
A K K V F K R L G I G A V L W V L T T G,1
T R S S S V H S A S L P A L T K T D,0
I C Y C R R R F C V C V G R,1
R G G R L C Y C R R R F C V C V G R,1
D R W I L H N L N E T I A K V T E N F D K F E F G V A G H I L Y N F,0
E D S E L S I V M R G L R D M N L S K L V D E D E P L,0
R G G G L C Y C R R R F C V C V G R,1
K R R K L I K I L K L I I K L I R K K R A M D,1
A C T K W K S F L K T F K S L K K T V L H T L L K A I S S A M D,0
E S L E L A I A A M T G M I R D V T I R A D R M K A A A G S G Y S T A T,0
I L C A E F P D E P K W M G G A E L S D D G R Y V L L,0
Y N R R A E R L R E L A E N N P L G D Y L R F A A L I A H,0
C G E S C V Y I P C I S G V I G C S C T D K V C Y L N G T P,1
M A Q D I I S T I G D L V K W I I D T V N K F P K K,1
T L D I E L R E I D E K L D M I L M S I P N I P H E S T P V,0
F T A P T R R Q V L S L Y K E F I K N A N Q F N N Y N F R,0
N P H G P G S T L P E S P V F L E P I N S T A P R,0
L T I P N L P A D E V P V G K D E N D N V,0
G R F R R L R K K T R K R L K K I G K V L K W I A M D,1
F I H H I F R G I V H A G R S I G R F L T G,1
S F I S G A D V C F V K W Y P S E Q Y,0
G I M S S L M K K L K A H I A K A M D,1
S D T F R E Q L P M A V D M L Q H,0
V R H I H F V G I G G A G M G G,0
G F L G I L F H G V H H G R K K A L H M N S E R R S,1
I L P W K W P W W P L R R,1
L F E H L L F S K N L D L S R K R D S Q T T N G L T N K,0
K K A A A F A A A A A F A A W A A F A A A K K K K,1
C G E S C V W I P C T I T A L A G C K C K S K V C Y N S I P,1
C G E S C V W I P C L T S A I G C S C K S K V C Y R N G I P,1
R S V A K T F V A E R K K L G F P L L D D A S R V A L L A E D M,0
G P Q H T V V L K D Q D G N,0
R L Y R R L Y R R L Y R R L Y R R L Y R R L Y R R L Y R R L Y R,1
L R W E E L T K L D R D A R K R E S R H L R,0
G F F A L I P K I I S S P L F K T L L S A V G S A L S S S G E Q E,1
Y H L S K E D A E V I N A T K K R G N K V I,0
G K L E V L H S T K K F A K G F I T G L T G Q,1
T C G E T C F G G T C N T P G C T C D P W P I C T D R G L P,1
K P E F V K P E D V S A D V V E K E Y Q V Q L D,0
V I P F V A S V A A E M M H H V Y C A A S K R C,1
I A D Y D A D L W Q A M,0
F I H H I I G G L F S A G K A I H R L I R R R R R A M D,1
D V Q L E I L K T I P G L E K A V L L Q P G Y A I E Y D F I D P R,0
M A Q D I I S T I G D L V K W I I D T V N K F T K K,1
G L A D Y W R T A F R A N F A N L G P G I R C K S A R C,1
F F H H I F R A I V H V A K T I H R L V T G,1
F F H H I F R G I V H V G K T A H R L V T G A M D,1
W L N A L L H H G L N C A K G V L A W L N A L L H H G L N C A K G V L A,1
Y V N E Q L A F T G D T L F S G G C G R L F E G S A E,0
L L G M I P L A I S A I S A L S K L,1
M V A L L K S L E R R R L M I T I S T M L Q F G L F L I A L I G L V I K L I E L S N K K,1
R I V V V D L H N P S I Q G F F N I P V D,0
K K K K K K A A A F A A A A A F A A W A A F A A A,1
N E S L K L R N E I E R I R S D A E E D I Q K W K K D V H M A Q N E L K,0
V C Y C R R R F C V C V G R,1
R Q I K I W F Q N R R L K W K K A M D,1
I L P L K L P W W P W R R,1
V C G E T C E G G T C N T P G C S C S W P V C T R N G L P,1
D F K D W M K T A G E W L K K K G P G I L K A A M A A A T,1
T C G E T C F G G T C N T P G C T C D P W P I C T D R G L P,1
G L K D K F K S M G E K L K Q Y I Q T W K A K F,1
S E E A L K A L H E S I I K A G Y K P G E D I A I A C D C A,0
G D K I R A L H M I L E M,0
K A V N K A G P G K P S D P T G N V,0
A K Y P I K P I K L D V E N K Q V V G D L Y N G L Y R K R Q L,0
M Q F I T D L I K K A V D F F K G L F G N K,1
F L G G L I K W P W W P W R R A M D,1
G L P K C G E T C V G G T C N T P G C T C S W P V C T R N,1
S L I R W M K A A I T A T A N Y L P P D I L S N H,0
N D A E I A A R L E R A A H Y P P F N C H T V N N D,0
K K L F K K I L K Y L A G P A K K L F K K I L K Y L A G P A K D W E H L K D W E H L K D W E H L K D E L,1
L R R L W L R A N R L,1
K A L A K E H G I E I K D T M K Y G H I L N E F F E Q K V E,0
E E R R G I H Q D A P E F A D Q S T E A E V L V,0
A K K V F K R L G I G A V L W V L T T G,1
D Y M K K L V T R L E E N N P S E V E V F K T N I N K,0
I D W S K I F E K V K N L V,1
I I S T I G K L V K W I I D T V,1
G A V V V P G S L P A K D G S H S L Y C A V I I K Q V,0
F G V L A K V A A H V V P A I A E H F,1
I V C P L I Q N D G A Y L L C K M A D D R G V F P G Q W,0
C D Q V Q S E L D Q A N S G T K F L L E R A D V L R S Q R,0
G E K L K K I G Q K I K N F F Q K L,1
G L G S L L G K A F K F G L K T V G K M M G G A P R E E,1
V T R A K Q I V W N G P V,0
L A N L K V S Q I K K V R L L I D E,0
S Q L G D L G S G A G Q G G G G G G S I R A A G G A F G K L E A A R E E E F F Y K K Q K E Q L E R L K N D Q I H Q A E F H H Q Q I K E H E E A I Q R H K D F L N N L H K,1
S K V G R H G R R F G H R A H R K L,1
R F P G L M M K L L V A M D,1
G F F G K M K E Y F K K F G A S F K R R F A N L K K R L,1
E W Q N N K Q S K Q Y I,0
F S E A I K K I I D F L G E G L F D I I K K I A E S F,1
A K R H H G Y K R K F H A K R H H G Y K R K F H A M D,1
K I S K K I M R T F L R R I L T G K K,1
V A V T R H G G T M A D S G S V A Y L F E R K G V V E,0
N K I I G L V P T M G N L H D G H I K L I L L A K K N V D I V I V S I,0
S I L N N P N P C D Y V L L E E V L K D A A N K K S S T P K S S Q,0
A S G K R A A M L R D G L H V V I V G A P N A G K,0
K R I R K R I K K W L R A M D,1
I F L A M I H F Y Q R F I S P L T,0
C Y C R K G H C K R G E R V R G T C G I R F L Y C C P R R G L L,1
V D R D D D L K I G V K S T A V L F,0
R R K I I A T K Y P T V A S K F F R E K G E D V E I I,0
I I G P V L G L V G S A L G G L L K K I A M D,1
S A P G L K I H A K L F L I S R L E N D E I V R Y A H I G T G N F N E K T A R I Y T D Y S L L T A D A R I T N E V,0
W C Y C R R R F C V C V G R,1
P A I C Q R A T A T L G T V G S N T S G T T E I A A C I L L,1
S C Q A L I L A P T R E L A Q Q I Q,0
K F I C P C H G S Q Y N N Q G K V V R,0
L G F G T F V L M L L G L V V E L I K,1
A C T A E R V G A G A P V Y L A M D,0
L L G D F F R K S K E K I G K E F K R I V Q R I K D F L R N L V P R T E S,1
F V P W F S K F L G R I L,1
G L F D I I K K I A E S F K F S E A I K K I I D F L G,1
D K S Y L E P Y L K E V I R E R K E R E E W A,0
G L N A F K K V F Q G I H E A I K L I N N H V Q,1
A C T K W K S F A K T F K S A K K T V A H T A L K A I S S A M D,0
M H L R Q Y E L L M I S P G S P P S I V A L G G G H G L Y V T L S A A,0
K F G K S T G G G N L W L D P E,0
D A L R G A M L S K D P T T G E T H,0
N I S K P I R E M L K N H F S I A R P E I V G E Q I S K D G T R K W L,0
P G A A A L V R H V H K A V A G V T D D L E,0
H S G T F S P Q T P V P A T,0
S I S L L Y G R K K R R Q R R R,0
W M G L D I G P D A V K V F Q D A L G D C,0
G F W K K V G S A A W G G V K A A A K G A A V G G L N A L A K H I Q,1
Y D P G R D G S E K K I R E C V I C M M D F V Y G,0
S Y D V C V S K D F L S K G D R V L F,0
R L M A A K A E S R K,1
G V L G T V K N L L I G A G K S A A Q S V L K T L S C K L S N D C,1
K G F F A L I P K I I S S P L F K T L L S A V,1
S K V W R H W R R F W H R A H R L H,1
G L F T L I K G A A K L I G K T V A K E A G K T G L E L M A C K I T N Q C,1
L R L K Y R R F K Y R V,1
F Y T H V F R L K K W M Q K V I D R F G G,0
L F G F L I K L I P S L F G A L S N I G R N R N Q,1
A P K V N V N A L R K G G R V I R K G L G V I G A A G T A H E V Y N H V R N R N Q G,0
A C T R R K K W F W A M D,0
R G G R L C Y C R R R F C V C V G R,1
D V T S L M L G P M V A A C G G Y V P M I S,0
K K L F K K I L K Y L T T G L P A L I S W,1
V C G E T C V G G T C N T P G C T C S W P V C T R D G L P,1
L L F K S P T C T Q Q D V K A A E E L K D I A K V D I Q K Y G L D M L,0
V G V H V I G D G A D E M L Q G F A V A V,0
L L R R L L R R L L R R L L R R A M D,1
K W K L F K K I G I G A V L K V L T T G L P A L K L T K,1
I K I P S F F R N I L K K V G K E A V S L I A G A L K Q S,1
F I G L L I S A G K A I H D L I R R R H,1
K V K V K V K V P P T K V K V K V K A M D,1
N G K A I L Y A D R M T D S I K K A M S E T E R R R L I Q E A,0
G L G S L L G K A F K I G L K T V G K M M G G A P R E Q,1
G F F A L I P K I I S S P L F K T L L S A V G S A L S S S G E Q E,1
S K R E I K N L R E L K I P W L R I L P Y I V D,0
S Q S G V E P Q T E T V W R Q A T E Y G V P R I V F A N K M D K I,0
F V Q W F S R F L G R I L,1
G F F A L I A K I I S S P L F K T L,1
P K R P G L S S L L S G Q F D S L A V R V S N H P G V Q A L C Q A L,0
F R W C F R V C Y K G R C R Y K C R,1
F R G L A K L L K I G L K S F A R V L K K V L P K A A K A G K A L A K S M A D E N A I R Q Q N Q,1
F H P S L W V L I P Q Y I Q L I R K I L K S G,1
K P W R F R R A I R R V R W R K V A P Y I P F V V K T V G K K,0
G L L D F V T G V G K D I F A Q L I K Q I,1
G L G K F L H S A K R F G K A F V G E A M N S A M D,0
C G E S C V W I P C L T S A V G C S C K S K V C Y R N G I P,1
G R T S K Q E L C T W E R G S V R Q A D K T I A G,0
P G R F E V V D G G Q N Y T V I V D Y A,0
V V I P F H H D I W S N F Q A D P Q E I R V L W,0
L R R L W L R A N R L L R R L W L R A N R L,1
C W S C M G H S C W S C M G H S C W S C A G H S C W S C M G H S C W S C M G H S C W S C A G H C C G S C W H G G M,0
L C Y C R R R F C V C V,1
I L P L K L P W W P W R R,1
G L K K I F K A G L G S L V K G I A A H V A S A M D,1
T E F N N G N M V M T A W S L F A A G T E T T S S T L R Q S F,0
A A T L P Q V R G L I M L A A T P C F V R R E D,0
G W K K W F T K G E R L S Q R H F A,1
A C T W R K K W F W A M D,0
L L I I L R R R W R K Q A R A R S K,1
G G T A G G W S N L D A D P T E T W M A T N G S A S S A Q L S,0
G I I N T L Q K Y Y Y R V R G G R Y A V L S Y L P K E E Q I G K Y S T R G R K Y Y R R K K,1
T T F E K G R C I Q A N Y S L K E N G K I K V L N Q E L R A D G T,0
A C T K L K S L L K T L S K A K K K K L K T L L K A L S K A M D,1
G K K L F K K I L K Y L A G P A K K L F K K I L K Y L K D E L,1
S V K K F W G G V K A I F K G A R K G L K,0
I I T N I R A D D I I N T A N K I F S G T T T L A I I G P,0
F A K K F A K K F K K F A K K F A K F A F A F,1
V S A V A K V A M K K G A A L L K K M G V K I S P L K,1
V G M H D K L F K R A R V M Y E I E R D I S,0
P R Q L T H D A G L T V D D I A K R L M D Y G,0
M S D F V N A I S E A V K A G L S A D W V T M G T S I A D A L A K G A D F I L G F F N,1
L E K G L D G A K K A V G G L G K L G K D A V E D L E S V G K G A V H D V K D V L D S V L,1
S L Q S K L D R K A E L D A T N A E L W R A S S T E V S D,0
T I S V V G W V H R R R D H G G,0
T R W L W L L R G G L K A A G W G I R A H L N R N Q,1
A V G I G A L F L G F L G A A G S T M G A R S,1
L K I F N T L S R Q K E E F K P I H A G E V G M,0
V V N L W A L H H N E K E W Q Q P D L F M P E R F L D P,0
G L N A L K K V F Q G I H E A I K L I N N H V Q A M D,1
K I P V V A A I H G A C L G G G L E L A L A C H Q R V,0
D F N D E P N D Y E Y E E E T N D E V D S R L F N I D D Q S D E E L Q S,0
E G K R I L I E G G Q A T M L D I D F G T Y P F V T S S N,0
P T L I V Y T I I V P E I R K E L Q R L V D M W D I P A,0
E E Y V R D V G E G L N P D I P Q N Y Y R Q D D P,0
W K R I V R R I W R W L R A M D,1
I T K V I A K L L N R L T K I L S K,1
F F H H I F R A I V H V A K T I H R L V T G,1
H L L T N F E I A I D P A V L P E L S E D E F Y W R E L F G M Q V V,0
F F H H I F R G I V H V G K K I H R L V T G,1
C G E S C V W I P C L T S A V G C S C K S K V C Y R N G I P,1
L L G D F F R K S K E K I G K E F K R I V Q R I K D F L R N L V P R T E S,1
M S S L Y S G W S S F T T G A S K F A S A A K E G A T K F G S Q A,0
S R N V E I E K R I L K L G T Q L A T L K N R G L P L G I A E E K M W,0
G G L A I A V E G P S K A E I S F E D R K D G S,0
G W L K K I G K K I E R V G Q N T R D A T I Q A I G V A Q Q A A N V A A T L K G,0
F R E R E Q A M I A E L C E,0
G I G K F L H K V K S F G K S W I G E I M N S A M D,1
W Y L T L T L G Y G R R,1
A Q D I I S T I G D L V K W I I D T V N K F T K K,1
G I W D T I K S M G K V F A G L I L Q N L A M D,1
Y K Q L M R I L T T M E N I A D L W N S A L T E L,0
F N K L D A L V F T G G I G E N A A N I R K N I I S K L,0
E L F A A V Q K I V N G R V P L I A G V G T N D T R D S I E F,0
G V F D I I K G A G K Q L I A R A M G K I A E K V G L N K D G N,0
E R Q V Q E L A F P G S A Q D V E R L L K K Q R,0
A K E N V E I Q A E N Q T L A T T T F Q N,0
W K R I V R W I K R W L R A M D,1
A W H C G E C K E I I V A R E,0
K V A K Q E K K K K K T G R A K R R,1
L E I E G A M A L L M K D A I K P N L,0
C G E S C V Y I P C I S G V I G C S C T D K V C Y L N G T P,1
W G R A F S R G V R R L A R G G R G A M D,0
S L W S S I K D M A A A A G R A A L N A V N G I V N P A M D,0
F E P A K R M G F T E F F S N G L V N E D L S P Y E V,0
G I G K F I H A A K K F G K L F I G E I M N S A M D,1
S F P F F P P G I C K R L K R C,1
R L W D I V R R W V G W L A M D,1
I C G E T C V G G T C N T P G C S C S W P V C T R N G L P,1
G L G S L L G K A F K F G L K T V G K M M G G A P R E Q,1
T T H H P D S L V T F D N S G N A P G T H Q S V H D T V N T Q D,0
I N L D A I A L M S C N P A,0
F K L R A K I K V R L R A K I K L,1
G F R K I V Q K I R D F L R N L V A M D,1
W A I T F L I I A I V A A V L G F G G I A G T A T G,0
I A A E R R Y A T I Y Q A R L W A F A M D,1
G I G H F L H K V K S F G K S W I G E I M N S A M D,1
R A Y C R R R F C V A R,1
M K D R R G Q V I Y V G K A I N L R S,0
V L E G L E F M G I Y W D P K K N E T I R G E E G F I N Y,0
S L W S S I K D M A A A A G R A A L N A V N G I L N P A M D,0
G W K S V F R K A K K V G K T V G G L A L D H Y L A M D,1
G L G S L L G K A F K F G L K T V G K M M G G A P R E Q,1
K A R I Q E L F A E A G L D A K Q A K L R S K Q V Y H,0
I L P W K W P F F P W R R,1
K W K S F L K T F K S A K K T V L H T A L K L I S S,1
G F F A L I P K I I S S P L F K T L L S A V G S A L S S S G G Q E,1
G F M K Y I G P L I P H A V K A I K K L I,1
W E S F S S V V P R T D W G L F F K G,0
G L K K I F K A G L G S L V K G I A A H V A S A M D,1
I L G K F W E G I K S L F A M D,1
L S M C G N S G Y E V I K I L E P Y V V N S L V Q,0
W S P Q E E D R I I E G G I,1
A Y G A T L P L N Q L A T I T V P E P R M L V I Q P F D A N T V,0
L R Q C L V T H N G R L L G I I T K K D,0
H V P E L K R M G A K A E I E G N T V I C G D V E R L S A A Q,0
R Q I W K F E C K A T V D G K A V C S A E,0
F R K L F R V Y S N F L R G K L K L,1
R A G L Q F P V G R L L R R L L R R L L R,1
C G E T C V G G T C N T P G C T C S W P V C T R N G L P V,1
A C T K W K S F L K T F K S A K K T V L H T L L K A I S S A M D,1
G L L S G I L G A G K H I I C G L S G L C,1
K R K R Q Q G I G A V L K V L T T G L P A L I S W I,1
V Y D D S K A V F P V,0
E V A E T V L G K L P K P R Y A D Y L P F K D,0
L L G M I P V A I S A I S A L S K L,1
A R H F E E E S K D L A G R L Q Y,0
L A L T L A P C A Q A A E P I E G K T V Y I D A G H G G,0
G F W K K V G S A A W G G V K A A A K G A A V G G L N A L A K H I Q,1
A C T A L K S L L K T L S K A A A A A L K T L L K A L S K A M D,1
G F G A L F K F L A K K V A K T V A K Q A A K Q G A K Y V V N K Q M E A M D,1
K W K S F L K T F K S A K K K V L H K A L K A I S S,1
C K T R T S T N T D H L W I A K S K A R L S E T,1
K V K V K V K V P P T K V K V K V K A M D,1
D C T R W I I G I N G R I C R D,1
F V P W F S K F L G R I L,1
Q L Q G K Q V S G E V V Q K V L Q E L I Q S V A K P,1
A A A L E K K N V D L N E L L Q R,0
V C G E T C V G G T C N T P G C S C S R P V C T R N G L P,1
I S V E D I K N T L G N T D I I K N,0
S S R G S A K D E T Q T S G E E P A P A K S F,0
R Q R L P G P P D A P G A V F V L G G E G L R A E L R A A G L R,0
G L L S G I L G A G K Q K V C G L S G L C,1
S L G N F F R K A R K K I G E E F K R I V Q R I K D F L Q H L I P R T E A,1
I W R I F R R I F R I F I R F A M D,1
G L K K I F K A G L G S L V K G I K A H V A S A M D,1
S R L K A T Q S Q V F,0
I G M G E R T S H Q A I G Q V A R A L F A K G A A Q R V,0
I D S L P E K Y N T R V G D K G T Q L S G G Q K Q R I A,0
V Y V M P L G G R D E K L V I A,0
S K V L R H L R R F L H R A H R K L,1
F H P E K S G D A G S Q L L K N W I A T L M L A K R I I P C L D,0
L Q I R A P V N P T I W P L,0
F V R W F S R F L G R I L,1
G L L A L I S W I K R K R Q Q A M D,1
R V P L A D K P H E K T M,0
I L P Y K Y P Y Y P Y R R,1
G V S E P Y R M F T S R A E Y R,0
A W K V F K R L G I G A V L W V L T W G,1
G F F A L I P K I I S S P L F K T L L S A V,1
F R L H R E P D L P G T L L Q E D I L V,0
F F G W L I K P A I H A G K A I H G L I H R R R H,1
K S K E K I G K E F K R I V Q R I K D F L R N L V P R T E S,1
E G R R F R V V V V D S R P R L E G R H M L H S L V R A G V P T S,0
I L P W K K P K L P W R R A M D,0
M T D K Y K E R R F D T Y G Y E K,0
I L P W K L P W W P W R R,1
F S I S P G K V L D K F G K I V G K V L K Q L K K V S A V A K V,1
G F F A L I A Q I I S S P L F Q T L,1
G C S A T F S V L K K R R N C S N C G N I F,0
G L K E I F K A G L G S L V K G I A A H V A S,1
C T Y D A D T L S K D P A D G R,0
S R L N V P I V C T V I G E G G S G G A L A I G V G D K V N,0
V D P A G G V L E D D Y T V T,0
K K S S F A N V A A A T P A I K K P P S G F K,0
A V D Q P A V E A T A P I E P V Q A T P A Q R F P T L R Y L G Q V,0
K W C F C V C Y R G I C Y C R C R G,1
H V E C N V G W L E P L L E R V Y L S R K K V,0
T A D M L C F V S A C K D F C,0
A Y A E K S V Q A D L K E R F Q G L D I G D I I G V T G,0
F S A L F G M E K S I F R Q L K I Y,0
L R L K Y R R F K Y R V,1
R F G R F L R K I R R F R P K V T I T I Q G S A R F,1
A C T K W K S F L K T F K S L K K T V L H T L L K L I S S A M D,1
Q C R R L C Y K Q R C V T Y C R G R,1
A C T K W K S F L K T F K S A V K T V L H T A L K A I S S A M D,1
A C T K W K S F L K T F K S L K K T V L H T L L K A I S S A M D,0
F K T W K R P P F Q T S C S G I I K E,1
G L N A L K K V F Q K I H E A I K L I N N H V Q A M D,1
K K L F K K I L K Y L A G P A L Y K L I K K F L K K K D E L,1
R V L H G L G W K V L V C D P V R,0
V K P G D T I L G M S L D A G G H L T H G,0
K N W K G I A G M A K K L L G E N W K L M,1
E S E E E R M K F F R E Y G L K Y E L E K L R V D L E N,0
K R R L I L R I L R L A I R A L V K K R A M D,1
T V V R R R G R S P R R R T P S P R R R R S Q S P R R R R S Q S R E S Q C,0
L T E Q V R R K P Y S V I L L D E,0
G L N A L K K V F Q G I H K A I K K I N N H V Q,0
A C I I Q R K E S L V S H K Q E L I D K L L I R I N G V M Q A,0
G I G A V L K V L T T G L K W K L F K K I E K V G Q,1
Y Q I D Q L S K M T Y K N K S L N I H D L T A,0
E A D S A D G S F M D E L L T L M A A H R V W S R I P K I D K,0
W K S Y V R R W A M D,0
V L E Q V V Q Q G R P M L I I A E D V E G,0
D T K A L Y L S K R A E L A P C H R L K K K G S S S V R T Q S S E,0
F L F S L I R K A I G G L I S A F K,1
G L K K I F K A G L G S L K K G I A A H V A S,1
Q A L S S G A T V E Q A R Q E L V A K I G E N I K L R,0
I V I R H L Y I E R R M V P L N,0
F L G G L I K W W P W R R A M D,1
F E E V F D E N P D V M I R V I Q V I M I R L Q R V L F T A L R,0
F V R W F S K F L G R I L,1
G I P C A E S C V W I P C T V T A L V G C S C S D K V C Y N,1
F F H H I F R P I V H V P K T I H R L V T G,1
V R T Y N A V D V E G L Y T L G T V V V D Y R G Y R V T A Q S I I P,0
K K A A A A F A A F A A W F A A F A A A A K K K K,1
G P G P N G H S H L L K T P L G G Q K R S F S H L L P,0
I S V E D I K N T L G N T D I I K N,0
R I S F K K G K G S W I K N G L I K G I K G L G K E I S L D V I R T G I D I A G C K I K G E C,1
G L K E V L H S T K K F A K G F I T G L T G Q,1
A P Q L A D L R M I A E S V E I P V F A Q H I D P I K P G,0
M E S V S D A V Q L M L G F G T F V L M L L G L V V E L I K N S N K K,1
S S R A L V L D R D G Q V K,0
K K K A A A F A A W A A F A K K K,1
V E R S R K A A Q Q A D,0
C G E T C V G G T C N T P G C T C S W P V C T R N G L P V,1
I D K A E R G T R I V L H,0
T D F N I L Y S M M K K H E E F R W M R L R I R R,0
G L W S K I K E V G K E A A K A A A K A A G K A A L G A V S E A V A M D,1
D S H A K R H H G Y K R K F H E K H H S H R G Y,1
F V Q W F S K F L G R I L,1
G I I N T L Q K Y Y W R V R G G R W A V L S W L P K E E Q I G K W S T R G R K W W R R K K,1
L V P G G G A S E M A V A H A L T E K S K A M T,0
T L G I I F F A I F F R E P P R I S,0
G I G A V L I V L T T G L P A L I S W I K R K R Q Q,1
C A E S C V W I P C T V T A L L G C S C S N N V C Y N G I P,1
G T P C G E S C V Y I P C I S G V I G C S C T D K V C Y L N,1
L L I I L R R R W R K Q A K A K S K A M D,1
A C T A L K S L L K T L S K A K A A K L K T L L K A L S K A M D,1
E A Q N L E K E I A A L E Q A I Q G L E K E I P A L A Q Q I Q A L E L,1
V C G E T C V G G T C N T P G C T C S W P V C T R D G L P,1
I L P F K F P F F P F R R,1
A I V F D T V R R Y F T Y R G Y D V K Y V S N F T D V D D K,0
F F H H I F R G I V H V A K T I H R L V T G,1
C G E S C V W I P C I S A A L G C S C K N K V C Y R N G I P,1
K V K V K V K V P P T K V K V K V K A M D,1
K K L F K K I L K Y L K K L F K K I L K Y L K K L F K K I L K Y L,1
F L G L L F H G V H H V G K W I H G L I H G H H,1
G L F D I I K A I A E S F A M D,1
T Y D N I K A M K K Q L R S I G L S L D W S R,0
I I K V P L K K F K S M R E V M R D H G I K A P V V D P A T K Y,0
F C Y C R R R F C V C V G R,1
F L R F I G S V I H G I G H L V H H I G V A L A M D,1
K Q Y Q H E E D E D F Y P D S M E Y S,0
G I L K T I K S I A S K V A N T V Q K L K R K A K N A V,1
G N G N L L G G L L R P V L G V V K G L T G G L G K K,0
K R R L I F R I L K L F F R F L V K K R A M D,1
A I M R E T N A P V V F D A T H S V Q L P G G Q G T S S G G Q R E F,0
G Q E D A D R D G I G D A C D D D A D G D G I L,0
F L P L V T M L L G K L F A M D,1
P R I V Y L N K M D R V G A D F F,0
G L K K I F K A G L G S L V K G I A A H V A S,1
R L Y R R L Y R R L Y R R L Y R R L Y R R L Y R R L Y R R L Y R,1
W K R W V Q R W K R F L R A M D,1
K E R T L K R L E R T L Q F L K K T M T V K T R F,0
I Q L Y L S A A T T A V K E G R N Q,0
V E S F D Q F V I L L K N T V S Q M V Y K H A I S T V,0
G F G A L F K F L A K K V A K T V A K Q A A K Q G A K Y V V N K Q M E A M D,1
E N R S H V I F V L W G N A A R K K C D L L F H S S H K H A,0
A S F H S V S K G Y M G E C G F R G G Y V E,0
V C G E T C V G G T C N T P G C S C S R P V C T R N G L P,1
V R R F P A A A P F L R R,1
P V H M T T A V F F D F G,0
G F L S I L K K V L P K V M A H M K,1
M L D A Y G D I A K I D S A R R C G L Y H F C L K N T P H,0
R Q I W K F E C K A T V D G K A V C S A E,0
R F F A S S I L H H T S E C T Q M D H L G C L H Y,0
I L P W K W P W L P L R R,1
S Y N D A L I G D I E V M D D T A I S L A K D N,0
A C T K W K S F L K T F K S A K K T V L H T A L K A I S S A M D,0
G I G K F I H A V K K W G K T F I G E I A K S A M D,1
W K R W V R R W K R W L R A M D,1
V D L T L D E K G E N G V G E L S S E Y N R L Q E K F E E,0
A P H P Y G V P T P P T G A Y S R A G,0
C V H W Q T N P A R T S C I G P,1
A C T K W K S F L K T F K S A V K T V L H T A L K A I S S A M D,1
K N W K G I A G M A K K L L G E N W E L M,1
Y E R S L A V I T A A R D Y G L V T K S N L I L G M,0
F F G W L I K G A I H A G K A I H G L I H R R R H A M D,1
Y V N E Q L A F T G D T L F S G G C G R L F E G S A E,0
C G E S C V W I P C I S S A I G C S C K N K V C Y R N G I P,1
L L L S A D L N R L A D Y L N P D L K K L Q A K G I T S V K S R,0
H L L Y L Y R S F T S Q T Y M D S S T V H L F V T I I S,0
G I G K F L H S A G K F G K A F V G E I M K S,0
L M E A G F D V D V A T L S G Y P V K L E L W A M P,0
F F H H I F R G I V H V A K T I H R L V T G,1
L C Y C R R R F C W C V,1
R E I S T I T P R F T V V E K D P K L A S F I R N E Y P,0
T Q S E Y Y N H A I D W Q T G P G,0
G I W S S I K N L A S K A W N S D I G Q S L R N K A A G A I N K F V A D K I G V T P S Q A A S,1
H I M S E K E I M G E A N C Q F I V K L F K T F K D K K,0
Y D L V K T M R A S I W A L G P L V A R F G Q G Q V S L P G G,0
C G L G F K A F W E E E T G F H Y D L F D K I D P K L S,0
A A G L A M L F L G I L S A A G S T M G A R A,1
G L F D V I R K V A S V I G G L,1
I L P L K L P W L P L R R,1
G L F G V L A K V A A H V V P A I A E H F,1
T S T E S R G T D T E S S G E E K D S D S M E D T G H Y S I N D,0
R A G L Q F P V G R L L R R L L R R L L R,1
